/*M!999999\- enable the sandbox mode */ 
-- MariaDB dump 10.19-11.7.2-MariaDB, for osx10.20 (arm64)
--
-- Host: 127.0.0.1    Database: vn_lottery
-- ------------------------------------------------------
-- Server version	11.7.2-MariaDB

/*!40101 SET @OLD_CHARACTER_SET_CLIENT=@@CHARACTER_SET_CLIENT */;
/*!40101 SET @OLD_CHARACTER_SET_RESULTS=@@CHARACTER_SET_RESULTS */;
/*!40101 SET @OLD_COLLATION_CONNECTION=@@COLLATION_CONNECTION */;
/*!40101 SET NAMES utf8mb4 */;
/*!40103 SET @OLD_TIME_ZONE=@@TIME_ZONE */;
/*!40103 SET TIME_ZONE='+00:00' */;
/*!40014 SET @OLD_UNIQUE_CHECKS=@@UNIQUE_CHECKS, UNIQUE_CHECKS=0 */;
/*!40014 SET @OLD_FOREIGN_KEY_CHECKS=@@FOREIGN_KEY_CHECKS, FOREIGN_KEY_CHECKS=0 */;
/*!40101 SET @OLD_SQL_MODE=@@SQL_MODE, SQL_MODE='NO_AUTO_VALUE_ON_ZERO' */;
/*M!100616 SET @OLD_NOTE_VERBOSITY=@@NOTE_VERBOSITY, NOTE_VERBOSITY=0 */;

--
-- Table structure for table `api_logs`
--

DROP TABLE IF EXISTS `api_logs`;
/*!40101 SET @saved_cs_client     = @@character_set_client */;
/*!40101 SET character_set_client = utf8mb4 */;
CREATE TABLE `api_logs` (
  `id` bigint(20) unsigned NOT NULL AUTO_INCREMENT,
  `endpoint` text NOT NULL,
  `province_code` varchar(255) DEFAULT NULL,
  `response_status` int(11) DEFAULT NULL,
  `response_time_ms` int(11) DEFAULT NULL,
  `error_message` text DEFAULT NULL,
  `fetched_count` int(11) NOT NULL DEFAULT 0,
  `created_at` timestamp NULL DEFAULT NULL,
  PRIMARY KEY (`id`),
  KEY `api_logs_province_code_index` (`province_code`),
  KEY `api_logs_created_at_index` (`created_at`)
) ENGINE=InnoDB AUTO_INCREMENT=101 DEFAULT CHARSET=utf8mb4 COLLATE=utf8mb4_unicode_ci;
/*!40101 SET character_set_client = @saved_cs_client */;

--
-- Dumping data for table `api_logs`
--

LOCK TABLES `api_logs` WRITE;
/*!40000 ALTER TABLE `api_logs` DISABLE KEYS */;
INSERT INTO `api_logs` VALUES
(1,'https://xoso188.net/api/front/open/lottery/history/list/game?gameCode=miba&limitNum=5','miba',200,446,NULL,0,NULL),
(2,'https://xoso188.net/api/front/open/lottery/history/list/game?gameCode=miba&limitNum=5','miba',200,334,NULL,5,NULL),
(3,'https://xoso188.net/api/front/open/lottery/history/list/game?gameCode=miba&limitNum=5','miba',200,423,NULL,5,NULL),
(4,'https://xoso188.net/api/front/open/lottery/history/list/game?gameCode=qung&limitNum=3','qung',200,360,NULL,3,NULL),
(5,'https://xoso188.net/api/front/open/lottery/history/list/game?gameCode=tphc&limitNum=3','tphc',200,343,NULL,3,NULL),
(6,'https://xoso188.net/api/front/open/lottery/history/list/game?gameCode=miba&limitNum=30','miba',200,445,NULL,30,NULL),
(7,'https://xoso188.net/api/front/open/lottery/history/list/game?gameCode=qung&limitNum=30','qung',200,370,NULL,30,NULL),
(8,'https://xoso188.net/api/front/open/lottery/history/list/game?gameCode=dana&limitNum=30','dana',200,346,NULL,30,NULL),
(9,'https://xoso188.net/api/front/open/lottery/history/list/game?gameCode=khho&limitNum=30','khho',200,368,NULL,30,NULL),
(10,'https://xoso188.net/api/front/open/lottery/history/list/game?gameCode=tphc&limitNum=30','tphc',200,360,NULL,30,NULL),
(11,'https://xoso188.net/api/front/open/lottery/history/list/game?gameCode=dona&limitNum=30','dona',200,359,NULL,30,NULL),
(12,'https://xoso188.net/api/front/open/lottery/history/list/game?gameCode=cath&limitNum=30','cath',200,343,NULL,30,NULL),
(13,'https://xoso188.net/api/front/open/lottery/history/list/game?gameCode=miba&limitNum=10','miba',200,514,NULL,10,NULL),
(14,'https://xoso188.net/api/front/open/lottery/history/list/game?gameCode=qung&limitNum=10','qung',200,382,NULL,10,NULL),
(15,'https://xoso188.net/api/front/open/lottery/history/list/game?gameCode=tphc&limitNum=10','tphc',200,447,NULL,10,NULL),
(16,'https://xoso188.net/api/front/open/lottery/history/list/game?gameCode=miba&limitNum=5','miba',200,464,NULL,5,NULL),
(17,'https://xoso188.net/api/front/open/lottery/history/list/game?gameCode=qung&limitNum=5','qung',200,385,NULL,5,NULL),
(18,'https://xoso188.net/api/front/open/lottery/history/list/game?gameCode=dana&limitNum=5','dana',200,242,NULL,5,NULL),
(19,'https://xoso188.net/api/front/open/lottery/history/list/game?gameCode=dano&limitNum=5','dano',200,266,NULL,5,NULL),
(20,'https://xoso188.net/api/front/open/lottery/history/list/game?gameCode=nith&limitNum=5','nith',200,363,NULL,5,NULL),
(21,'https://xoso188.net/api/front/open/lottery/history/list/game?gameCode=gila&limitNum=5','gila',200,267,NULL,5,NULL),
(22,'https://xoso188.net/api/front/open/lottery/history/list/game?gameCode=qutr&limitNum=5','qutr',200,242,NULL,5,NULL),
(23,'https://xoso188.net/api/front/open/lottery/history/list/game?gameCode=qubi&limitNum=5','qubi',200,234,NULL,5,NULL),
(24,'https://xoso188.net/api/front/open/lottery/history/list/game?gameCode=bidi&limitNum=5','bidi',200,359,NULL,5,NULL),
(25,'https://xoso188.net/api/front/open/lottery/history/list/game?gameCode=khho&limitNum=5','khho',200,389,NULL,5,NULL),
(26,'https://xoso188.net/api/front/open/lottery/history/list/game?gameCode=quna&limitNum=5','quna',200,372,NULL,5,NULL),
(27,'https://xoso188.net/api/front/open/lottery/history/list/game?gameCode=dalak&limitNum=5','dalak',200,280,NULL,5,NULL),
(28,'https://xoso188.net/api/front/open/lottery/history/list/game?gameCode=thth&limitNum=5','thth',200,264,NULL,5,NULL),
(29,'https://xoso188.net/api/front/open/lottery/history/list/game?gameCode=phye&limitNum=5','phye',200,265,NULL,5,NULL),
(30,'https://xoso188.net/api/front/open/lottery/history/list/game?gameCode=kotu&limitNum=5','kotu',200,498,NULL,5,NULL),
(31,'https://xoso188.net/api/front/open/lottery/history/list/game?gameCode=hagi&limitNum=5','hagi',200,279,NULL,5,NULL),
(32,'https://xoso188.net/api/front/open/lottery/history/list/game?gameCode=tphc&limitNum=5','tphc',200,266,NULL,5,NULL),
(33,'https://xoso188.net/api/front/open/lottery/history/list/game?gameCode=biph&limitNum=5','biph',200,254,NULL,5,NULL),
(34,'https://xoso188.net/api/front/open/lottery/history/list/game?gameCode=loan&limitNum=5','loan',200,266,NULL,5,NULL),
(35,'https://xoso188.net/api/front/open/lottery/history/list/game?gameCode=bidu&limitNum=5','bidu',200,233,NULL,5,NULL),
(36,'https://xoso188.net/api/front/open/lottery/history/list/game?gameCode=trvi&limitNum=5','trvi',200,269,NULL,5,NULL),
(37,'https://xoso188.net/api/front/open/lottery/history/list/game?gameCode=vilo&limitNum=5','vilo',200,345,NULL,5,NULL),
(38,'https://xoso188.net/api/front/open/lottery/history/list/game?gameCode=bith&limitNum=5','bith',200,263,NULL,5,NULL),
(39,'https://xoso188.net/api/front/open/lottery/history/list/game?gameCode=tani&limitNum=5','tani',200,267,NULL,5,NULL),
(40,'https://xoso188.net/api/front/open/lottery/history/list/game?gameCode=angi&limitNum=5','angi',200,271,NULL,5,NULL),
(41,'https://xoso188.net/api/front/open/lottery/history/list/game?gameCode=sotr&limitNum=5','sotr',200,255,NULL,5,NULL),
(42,'https://xoso188.net/api/front/open/lottery/history/list/game?gameCode=dona&limitNum=5','dona',200,259,NULL,5,NULL),
(43,'https://xoso188.net/api/front/open/lottery/history/list/game?gameCode=cath&limitNum=5','cath',200,273,NULL,5,NULL),
(44,'https://xoso188.net/api/front/open/lottery/history/list/game?gameCode=vuta&limitNum=5','vuta',200,276,NULL,5,NULL),
(45,'https://xoso188.net/api/front/open/lottery/history/list/game?gameCode=bali&limitNum=5','bali',200,262,NULL,5,NULL),
(46,'https://xoso188.net/api/front/open/lottery/history/list/game?gameCode=cama&limitNum=5','cama',200,262,NULL,5,NULL),
(47,'https://xoso188.net/api/front/open/lottery/history/list/game?gameCode=doth&limitNum=5','doth',200,269,NULL,5,NULL),
(48,'https://xoso188.net/api/front/open/lottery/history/list/game?gameCode=dalat&limitNum=5','dalat',200,332,NULL,5,NULL),
(49,'https://xoso188.net/api/front/open/lottery/history/list/game?gameCode=tigi&limitNum=5','tigi',200,264,NULL,5,NULL),
(50,'https://xoso188.net/api/front/open/lottery/history/list/game?gameCode=kigi&limitNum=5','kigi',200,252,NULL,5,NULL),
(51,'https://xoso188.net/api/front/open/lottery/history/list/game?gameCode=miba&limitNum=30','miba',200,397,NULL,30,NULL),
(52,'https://xoso188.net/api/front/open/lottery/history/list/game?gameCode=quni&limitNum=30','quni',200,329,NULL,30,NULL),
(53,'https://xoso188.net/api/front/open/lottery/history/list/game?gameCode=bani&limitNum=30','bani',200,335,NULL,30,NULL),
(54,'https://xoso188.net/api/front/open/lottery/history/list/game?gameCode=haph&limitNum=30','haph',200,333,NULL,30,NULL),
(55,'https://xoso188.net/api/front/open/lottery/history/list/game?gameCode=nadi&limitNum=30','nadi',200,327,NULL,30,NULL),
(56,'https://xoso188.net/api/front/open/lottery/history/list/game?gameCode=thbi&limitNum=30','thbi',200,379,NULL,30,NULL),
(57,'https://xoso188.net/api/front/open/lottery/history/list/game?gameCode=quni&limitNum=1','quni',200,411,NULL,1,NULL),
(58,'https://xoso188.net/api/front/open/lottery/history/list/game?gameCode=miba&limitNum=1','miba',200,460,NULL,1,NULL),
(59,'https://xoso188.net/api/front/open/lottery/history/list/game?gameCode=qung&limitNum=1','qung',200,358,NULL,1,NULL),
(60,'https://xoso188.net/api/front/open/lottery/history/list/game?gameCode=dana&limitNum=1','dana',200,333,NULL,1,NULL),
(61,'https://xoso188.net/api/front/open/lottery/history/list/game?gameCode=dano&limitNum=1','dano',200,330,NULL,1,NULL),
(62,'https://xoso188.net/api/front/open/lottery/history/list/game?gameCode=nith&limitNum=1','nith',200,363,NULL,1,NULL),
(63,'https://xoso188.net/api/front/open/lottery/history/list/game?gameCode=gila&limitNum=1','gila',200,411,NULL,1,NULL),
(64,'https://xoso188.net/api/front/open/lottery/history/list/game?gameCode=qutr&limitNum=1','qutr',200,344,NULL,1,NULL),
(65,'https://xoso188.net/api/front/open/lottery/history/list/game?gameCode=qubi&limitNum=1','qubi',200,1011,NULL,1,NULL),
(66,'https://xoso188.net/api/front/open/lottery/history/list/game?gameCode=bidi&limitNum=1','bidi',200,827,NULL,1,NULL),
(67,'https://xoso188.net/api/front/open/lottery/history/list/game?gameCode=khho&limitNum=1','khho',200,344,NULL,1,NULL),
(68,'https://xoso188.net/api/front/open/lottery/history/list/game?gameCode=quna&limitNum=1','quna',200,407,NULL,1,NULL),
(69,'https://xoso188.net/api/front/open/lottery/history/list/game?gameCode=dalak&limitNum=1','dalak',200,308,NULL,1,NULL),
(70,'https://xoso188.net/api/front/open/lottery/history/list/game?gameCode=thth&limitNum=1','thth',200,377,NULL,1,NULL),
(71,'https://xoso188.net/api/front/open/lottery/history/list/game?gameCode=phye&limitNum=1','phye',200,318,NULL,1,NULL),
(72,'https://xoso188.net/api/front/open/lottery/history/list/game?gameCode=kotu&limitNum=1','kotu',200,461,NULL,1,NULL),
(73,'https://xoso188.net/api/front/open/lottery/history/list/game?gameCode=hagi&limitNum=1','hagi',200,314,NULL,1,NULL),
(74,'https://xoso188.net/api/front/open/lottery/history/list/game?gameCode=tphc&limitNum=1','tphc',200,379,NULL,1,NULL),
(75,'https://xoso188.net/api/front/open/lottery/history/list/game?gameCode=biph&limitNum=1','biph',200,336,NULL,1,NULL),
(76,'https://xoso188.net/api/front/open/lottery/history/list/game?gameCode=loan&limitNum=1','loan',200,1526,NULL,1,NULL),
(77,'https://xoso188.net/api/front/open/lottery/history/list/game?gameCode=bidu&limitNum=1','bidu',200,481,NULL,1,NULL),
(78,'https://xoso188.net/api/front/open/lottery/history/list/game?gameCode=trvi&limitNum=1','trvi',200,412,NULL,1,NULL),
(79,'https://xoso188.net/api/front/open/lottery/history/list/game?gameCode=vilo&limitNum=1','vilo',200,327,NULL,1,NULL),
(80,'https://xoso188.net/api/front/open/lottery/history/list/game?gameCode=bith&limitNum=1','bith',200,312,NULL,1,NULL),
(81,'https://xoso188.net/api/front/open/lottery/history/list/game?gameCode=tani&limitNum=1','tani',200,325,NULL,1,NULL),
(82,'https://xoso188.net/api/front/open/lottery/history/list/game?gameCode=angi&limitNum=1','angi',200,407,NULL,1,NULL),
(83,'https://xoso188.net/api/front/open/lottery/history/list/game?gameCode=sotr&limitNum=1','sotr',200,312,NULL,1,NULL),
(84,'https://xoso188.net/api/front/open/lottery/history/list/game?gameCode=dona&limitNum=1','dona',200,328,NULL,1,NULL),
(85,'https://xoso188.net/api/front/open/lottery/history/list/game?gameCode=cath&limitNum=1','cath',200,356,NULL,1,NULL),
(86,'https://xoso188.net/api/front/open/lottery/history/list/game?gameCode=vuta&limitNum=1','vuta',200,377,NULL,1,NULL),
(87,'https://xoso188.net/api/front/open/lottery/history/list/game?gameCode=bali&limitNum=1','bali',200,309,NULL,1,NULL),
(88,'https://xoso188.net/api/front/open/lottery/history/list/game?gameCode=cama&limitNum=1','cama',200,328,NULL,1,NULL),
(89,'https://xoso188.net/api/front/open/lottery/history/list/game?gameCode=doth&limitNum=1','doth',200,402,NULL,1,NULL),
(90,'https://xoso188.net/api/front/open/lottery/history/list/game?gameCode=dalat&limitNum=1','dalat',200,323,NULL,1,NULL),
(91,'https://xoso188.net/api/front/open/lottery/history/list/game?gameCode=tigi&limitNum=1','tigi',200,434,NULL,1,NULL),
(92,'https://xoso188.net/api/front/open/lottery/history/list/game?gameCode=kigi&limitNum=1','kigi',200,311,NULL,1,NULL),
(93,'https://xoso188.net/api/front/open/lottery/history/list/game?gameCode=quni&limitNum=1','quni',200,369,NULL,1,NULL),
(94,'https://xoso188.net/api/front/open/lottery/history/list/game?gameCode=bani&limitNum=1','bani',200,369,NULL,1,NULL),
(95,'https://xoso188.net/api/front/open/lottery/history/list/game?gameCode=haph&limitNum=1','haph',200,343,NULL,1,NULL),
(96,'https://xoso188.net/api/front/open/lottery/history/list/game?gameCode=nadi&limitNum=1','nadi',200,325,NULL,1,NULL),
(97,'https://xoso188.net/api/front/open/lottery/history/list/game?gameCode=thbi&limitNum=1','thbi',200,323,NULL,1,NULL),
(98,'https://xoso188.net/api/front/open/lottery/history/list/game?gameCode=betre&limitNum=1','betre',400,320,NULL,0,NULL),
(99,'https://api-xsmb-today.onrender.com/api/v1','miba',200,758,NULL,1,NULL),
(100,'https://xoso188.net/api/front/open/lottery/history/list/game?gameCode=miba&limitNum=1','miba',200,497,NULL,1,NULL);
/*!40000 ALTER TABLE `api_logs` ENABLE KEYS */;
UNLOCK TABLES;

--
-- Table structure for table `cache`
--

DROP TABLE IF EXISTS `cache`;
/*!40101 SET @saved_cs_client     = @@character_set_client */;
/*!40101 SET character_set_client = utf8mb4 */;
CREATE TABLE `cache` (
  `key` varchar(255) NOT NULL,
  `value` mediumtext NOT NULL,
  `expiration` int(11) NOT NULL,
  PRIMARY KEY (`key`)
) ENGINE=InnoDB DEFAULT CHARSET=utf8mb4 COLLATE=utf8mb4_unicode_ci;
/*!40101 SET character_set_client = @saved_cs_client */;

--
-- Dumping data for table `cache`
--

LOCK TABLES `cache` WRITE;
/*!40000 ALTER TABLE `cache` DISABLE KEYS */;
/*!40000 ALTER TABLE `cache` ENABLE KEYS */;
UNLOCK TABLES;

--
-- Table structure for table `cache_locks`
--

DROP TABLE IF EXISTS `cache_locks`;
/*!40101 SET @saved_cs_client     = @@character_set_client */;
/*!40101 SET character_set_client = utf8mb4 */;
CREATE TABLE `cache_locks` (
  `key` varchar(255) NOT NULL,
  `owner` varchar(255) NOT NULL,
  `expiration` int(11) NOT NULL,
  PRIMARY KEY (`key`)
) ENGINE=InnoDB DEFAULT CHARSET=utf8mb4 COLLATE=utf8mb4_unicode_ci;
/*!40101 SET character_set_client = @saved_cs_client */;

--
-- Dumping data for table `cache_locks`
--

LOCK TABLES `cache_locks` WRITE;
/*!40000 ALTER TABLE `cache_locks` DISABLE KEYS */;
/*!40000 ALTER TABLE `cache_locks` ENABLE KEYS */;
UNLOCK TABLES;

--
-- Table structure for table `failed_jobs`
--

DROP TABLE IF EXISTS `failed_jobs`;
/*!40101 SET @saved_cs_client     = @@character_set_client */;
/*!40101 SET character_set_client = utf8mb4 */;
CREATE TABLE `failed_jobs` (
  `id` bigint(20) unsigned NOT NULL AUTO_INCREMENT,
  `uuid` varchar(255) NOT NULL,
  `connection` text NOT NULL,
  `queue` text NOT NULL,
  `payload` longtext NOT NULL,
  `exception` longtext NOT NULL,
  `failed_at` timestamp NOT NULL DEFAULT current_timestamp(),
  PRIMARY KEY (`id`),
  UNIQUE KEY `failed_jobs_uuid_unique` (`uuid`)
) ENGINE=InnoDB DEFAULT CHARSET=utf8mb4 COLLATE=utf8mb4_unicode_ci;
/*!40101 SET character_set_client = @saved_cs_client */;

--
-- Dumping data for table `failed_jobs`
--

LOCK TABLES `failed_jobs` WRITE;
/*!40000 ALTER TABLE `failed_jobs` DISABLE KEYS */;
/*!40000 ALTER TABLE `failed_jobs` ENABLE KEYS */;
UNLOCK TABLES;

--
-- Table structure for table `job_batches`
--

DROP TABLE IF EXISTS `job_batches`;
/*!40101 SET @saved_cs_client     = @@character_set_client */;
/*!40101 SET character_set_client = utf8mb4 */;
CREATE TABLE `job_batches` (
  `id` varchar(255) NOT NULL,
  `name` varchar(255) NOT NULL,
  `total_jobs` int(11) NOT NULL,
  `pending_jobs` int(11) NOT NULL,
  `failed_jobs` int(11) NOT NULL,
  `failed_job_ids` longtext NOT NULL,
  `options` mediumtext DEFAULT NULL,
  `cancelled_at` int(11) DEFAULT NULL,
  `created_at` int(11) NOT NULL,
  `finished_at` int(11) DEFAULT NULL,
  PRIMARY KEY (`id`)
) ENGINE=InnoDB DEFAULT CHARSET=utf8mb4 COLLATE=utf8mb4_unicode_ci;
/*!40101 SET character_set_client = @saved_cs_client */;

--
-- Dumping data for table `job_batches`
--

LOCK TABLES `job_batches` WRITE;
/*!40000 ALTER TABLE `job_batches` DISABLE KEYS */;
/*!40000 ALTER TABLE `job_batches` ENABLE KEYS */;
UNLOCK TABLES;

--
-- Table structure for table `jobs`
--

DROP TABLE IF EXISTS `jobs`;
/*!40101 SET @saved_cs_client     = @@character_set_client */;
/*!40101 SET character_set_client = utf8mb4 */;
CREATE TABLE `jobs` (
  `id` bigint(20) unsigned NOT NULL AUTO_INCREMENT,
  `queue` varchar(255) NOT NULL,
  `payload` longtext NOT NULL,
  `attempts` tinyint(3) unsigned NOT NULL,
  `reserved_at` int(10) unsigned DEFAULT NULL,
  `available_at` int(10) unsigned NOT NULL,
  `created_at` int(10) unsigned NOT NULL,
  PRIMARY KEY (`id`),
  KEY `jobs_queue_index` (`queue`)
) ENGINE=InnoDB AUTO_INCREMENT=87 DEFAULT CHARSET=utf8mb4 COLLATE=utf8mb4_unicode_ci;
/*!40101 SET character_set_client = @saved_cs_client */;

--
-- Dumping data for table `jobs`
--

LOCK TABLES `jobs` WRITE;
/*!40000 ALTER TABLE `jobs` DISABLE KEYS */;
/*!40000 ALTER TABLE `jobs` ENABLE KEYS */;
UNLOCK TABLES;

--
-- Table structure for table `lottery_results`
--

DROP TABLE IF EXISTS `lottery_results`;
/*!40101 SET @saved_cs_client     = @@character_set_client */;
/*!40101 SET character_set_client = utf8mb4 */;
CREATE TABLE `lottery_results` (
  `id` bigint(20) unsigned NOT NULL AUTO_INCREMENT,
  `province_id` bigint(20) unsigned NOT NULL,
  `turn_num` varchar(255) NOT NULL,
  `draw_date` date NOT NULL,
  `draw_time` datetime NOT NULL,
  `draw_timestamp` bigint(20) DEFAULT NULL,
  `open_num` varchar(255) DEFAULT NULL,
  `prize_special` varchar(255) DEFAULT NULL,
  `prize_1` varchar(255) DEFAULT NULL,
  `prize_2` varchar(255) DEFAULT NULL,
  `prize_3` text DEFAULT NULL,
  `prize_4` text DEFAULT NULL,
  `prize_5` varchar(255) DEFAULT NULL,
  `prize_6` text DEFAULT NULL,
  `prize_7` varchar(255) DEFAULT NULL,
  `prize_8` varchar(255) DEFAULT NULL,
  `detail_json` longtext CHARACTER SET utf8mb4 COLLATE utf8mb4_bin DEFAULT NULL CHECK (json_valid(`detail_json`)),
  `status` int(11) NOT NULL DEFAULT 0,
  `created_at` timestamp NULL DEFAULT NULL,
  `updated_at` timestamp NULL DEFAULT NULL,
  PRIMARY KEY (`id`),
  UNIQUE KEY `lottery_results_province_id_turn_num_unique` (`province_id`,`turn_num`),
  KEY `lottery_results_province_id_index` (`province_id`),
  KEY `lottery_results_draw_date_index` (`draw_date`),
  KEY `lottery_results_turn_num_index` (`turn_num`),
  CONSTRAINT `lottery_results_province_id_foreign` FOREIGN KEY (`province_id`) REFERENCES `provinces` (`id`) ON DELETE CASCADE
) ENGINE=InnoDB AUTO_INCREMENT=513 DEFAULT CHARSET=utf8mb4 COLLATE=utf8mb4_unicode_ci;
/*!40101 SET character_set_client = @saved_cs_client */;

--
-- Dumping data for table `lottery_results`
--

LOCK TABLES `lottery_results` WRITE;
/*!40000 ALTER TABLE `lottery_results` DISABLE KEYS */;
INSERT INTO `lottery_results` VALUES
(1,1,'17/01/2026','2026-01-17','2026-01-17 18:15:00',1768648500000,'0,9,8,2,4','09824','38842','57875,36581','49247,00737,40091,36121,42248,11896','9500,2888,8937,6589','3615,3768,6201,0787,8994,0497','800,491,957','54,43,74,64',NULL,'[\"09824\",\"38842\",\"57875,36581\",\"49247,00737,40091,36121,42248,11896\",\"9500,2888,8937,6589\",\"3615,3768,6201,0787,8994,0497\",\"800,491,957\",\"54,43,74,64\"]',2,'2026-01-17 06:33:25','2026-01-17 06:33:25'),
(2,1,'16/01/2026','2026-01-16','2026-01-16 18:15:00',1768562100000,'9,0,1,2,8','90128','87289','80910,58166','03971,35172,81844,58854,87945,71849','0969,6191,1726,7177','0199,6087,5956,0571,7403,7046','132,666,595','94,79,33,40',NULL,'[\"90128\",\"87289\",\"80910,58166\",\"03971,35172,81844,58854,87945,71849\",\"0969,6191,1726,7177\",\"0199,6087,5956,0571,7403,7046\",\"132,666,595\",\"94,79,33,40\"]',2,'2026-01-17 06:33:25','2026-01-17 06:33:25'),
(3,1,'15/01/2026','2026-01-15','2026-01-15 18:15:00',1768475700000,'8,4,5,2,2','84522','41647','68429,43071','13656,17226,56960,32399,24912,87150','8476,1756,8256,3416','4039,7861,2800,8288,8644,4014','497,368,374','21,00,14,71',NULL,'[\"84522\",\"41647\",\"68429,43071\",\"13656,17226,56960,32399,24912,87150\",\"8476,1756,8256,3416\",\"4039,7861,2800,8288,8644,4014\",\"497,368,374\",\"21,00,14,71\"]',2,'2026-01-17 06:33:25','2026-01-17 06:33:25'),
(4,1,'14/01/2026','2026-01-14','2026-01-14 18:15:00',1768389300000,'0,2,8,1,7','02817','24517','74215,46621','79283,78432,76304,87446,85707,10084','5422,1753,9687,8395','2844,1358,6578,1837,3246,3689','945,187,978','15,99,52,55',NULL,'[\"02817\",\"24517\",\"74215,46621\",\"79283,78432,76304,87446,85707,10084\",\"5422,1753,9687,8395\",\"2844,1358,6578,1837,3246,3689\",\"945,187,978\",\"15,99,52,55\"]',2,'2026-01-17 06:33:25','2026-01-17 06:33:25'),
(5,1,'13/01/2026','2026-01-13','2026-01-13 18:15:00',1768302900000,'2,8,0,2,7','28027','19534','40983,83563','98542,55671,77880,26614,09288,10383','8135,5457,0803,9273','7339,2012,6488,0064,8499,1774','508,652,762','82,24,25,16',NULL,'[\"28027\",\"19534\",\"40983,83563\",\"98542,55671,77880,26614,09288,10383\",\"8135,5457,0803,9273\",\"7339,2012,6488,0064,8499,1774\",\"508,652,762\",\"82,24,25,16\"]',2,'2026-01-17 06:33:25','2026-01-17 06:33:25'),
(6,2,'17/01/2026','2026-01-17','2026-01-17 17:15:00',1768644900000,'2,3,6,6,9,2','236692','38629','01557','35174,76195','46418,22190,75126,39053,66038,35554,62423','6266','7881,4454,8661','091','42','[\"236692\",\"38629\",\"01557\",\"35174,76195\",\"46418,22190,75126,39053,66038,35554,62423\",\"6266\",\"7881,4454,8661\",\"091\",\"42\"]',2,'2026-01-17 06:33:46','2026-01-17 06:33:46'),
(7,2,'10/01/2026','2026-01-10','2026-01-10 17:15:00',1768040100000,'4,3,4,3,7,1','434371','39488','91629','86212,70639','53654,60230,09934,44593,39994,85419,42066','4932','1092,8785,7643','313','01','[\"434371\",\"39488\",\"91629\",\"86212,70639\",\"53654,60230,09934,44593,39994,85419,42066\",\"4932\",\"1092,8785,7643\",\"313\",\"01\"]',2,'2026-01-17 06:33:46','2026-01-17 06:33:46'),
(8,2,'03/01/2026','2026-01-03','2026-01-03 17:15:00',1767435300000,'1,7,6,4,4,4','176444','67668','23616','84829,41266','65790,19708,40592,86308,39412,24524,13015','7391','9940,0319,5983','423','06','[\"176444\",\"67668\",\"23616\",\"84829,41266\",\"65790,19708,40592,86308,39412,24524,13015\",\"7391\",\"9940,0319,5983\",\"423\",\"06\"]',2,'2026-01-17 06:33:46','2026-01-17 06:33:46'),
(9,17,'17/01/2026','2026-01-17','2026-01-17 16:15:00',1768641300000,'4,2,6,7,1,6','426716','57725','90984','19734,05551','33785,14080,47383,79628,89204,47032,20244','8577','2105,3278,6148','782','62','[\"426716\",\"57725\",\"90984\",\"19734,05551\",\"33785,14080,47383,79628,89204,47032,20244\",\"8577\",\"2105,3278,6148\",\"782\",\"62\"]',2,'2026-01-17 06:33:59','2026-01-17 06:33:59'),
(10,17,'12/01/2026','2026-01-12','2026-01-12 16:15:00',1768209300000,'9,6,5,4,0,6','965406','01618','70088','51462,68841','87444,62356,21501,31591,23054,22168,38719','6560','1295,6808,2651','249','12','[\"965406\",\"01618\",\"70088\",\"51462,68841\",\"87444,62356,21501,31591,23054,22168,38719\",\"6560\",\"1295,6808,2651\",\"249\",\"12\"]',2,'2026-01-17 06:33:59','2026-01-17 06:33:59'),
(11,17,'10/01/2026','2026-01-10','2026-01-10 16:15:00',1768036500000,'5,3,2,8,8,7','532887','79162','74095','49350,81999','42171,24769,06778,26597,30455,96135,32961','1006','8613,0815,2852','459','87','[\"532887\",\"79162\",\"74095\",\"49350,81999\",\"42171,24769,06778,26597,30455,96135,32961\",\"1006\",\"8613,0815,2852\",\"459\",\"87\"]',2,'2026-01-17 06:33:59','2026-01-17 06:33:59'),
(12,1,'12/01/2026','2026-01-12','2026-01-12 18:15:00',1768216500000,'3,1,8,9,4','31894','58524','99688,98714','80158,02439,79195,56597,11543,45857','7282,1938,2863,1645','6652,1464,0773,6100,6739,3640','301,697,335','31,34,20,42',NULL,'[\"31894\",\"58524\",\"99688,98714\",\"80158,02439,79195,56597,11543,45857\",\"7282,1938,2863,1645\",\"6652,1464,0773,6100,6739,3640\",\"301,697,335\",\"31,34,20,42\"]',2,'2026-01-17 06:35:19','2026-01-17 06:35:19'),
(13,1,'11/01/2026','2026-01-11','2026-01-11 18:15:00',1768130100000,'8,2,4,3,8','82438','32172','39869,21073','48067,07113,74630,05458,91202,00608','1508,4847,5535,3417','1130,7400,4663,1636,7725,6936','768,195,519','70,95,10,43',NULL,'[\"82438\",\"32172\",\"39869,21073\",\"48067,07113,74630,05458,91202,00608\",\"1508,4847,5535,3417\",\"1130,7400,4663,1636,7725,6936\",\"768,195,519\",\"70,95,10,43\"]',2,'2026-01-17 06:35:19','2026-01-17 06:35:19'),
(14,1,'10/01/2026','2026-01-10','2026-01-10 18:15:00',1768043700000,'6,7,7,9,3','67793','86783','54358,84754','09108,63654,43443,17021,22427,04093','2131,0472,7070,2787','3778,6260,7787,9014,8094,7516','762,712,486','70,45,14,13',NULL,'[\"67793\",\"86783\",\"54358,84754\",\"09108,63654,43443,17021,22427,04093\",\"2131,0472,7070,2787\",\"3778,6260,7787,9014,8094,7516\",\"762,712,486\",\"70,45,14,13\"]',2,'2026-01-17 06:35:19','2026-01-17 06:35:19'),
(15,1,'09/01/2026','2026-01-09','2026-01-09 18:15:00',1767957300000,'3,9,5,2,3','39523','84612','62848,55433','59721,06536,62346,15182,57370,06441','7792,7911,5610,6426','3878,8812,4186,9423,4866,3766','417,102,243','47,87,52,46',NULL,'[\"39523\",\"84612\",\"62848,55433\",\"59721,06536,62346,15182,57370,06441\",\"7792,7911,5610,6426\",\"3878,8812,4186,9423,4866,3766\",\"417,102,243\",\"47,87,52,46\"]',2,'2026-01-17 06:35:19','2026-01-17 06:35:19'),
(16,1,'08/01/2026','2026-01-08','2026-01-08 18:15:00',1767870900000,'4,0,1,6,2','40162','03251','43668,39741','29338,34653,54266,18115,52822,89935','8827,4749,1127,4922','5415,3472,3302,2944,2365,2143','021,854,337','54,88,82,13',NULL,'[\"40162\",\"03251\",\"43668,39741\",\"29338,34653,54266,18115,52822,89935\",\"8827,4749,1127,4922\",\"5415,3472,3302,2944,2365,2143\",\"021,854,337\",\"54,88,82,13\"]',2,'2026-01-17 06:35:19','2026-01-17 06:35:19'),
(17,1,'07/01/2026','2026-01-07','2026-01-07 18:15:00',1767784500000,'1,4,3,8,9','14389','06509','13267,17968','74323,08916,08345,44717,73749,32966','8786,8627,4145,5444','9205,9877,6869,9819,0107,1776','065,764,088','39,64,24,57',NULL,'[\"14389\",\"06509\",\"13267,17968\",\"74323,08916,08345,44717,73749,32966\",\"8786,8627,4145,5444\",\"9205,9877,6869,9819,0107,1776\",\"065,764,088\",\"39,64,24,57\"]',2,'2026-01-17 06:35:19','2026-01-17 06:35:19'),
(18,1,'06/01/2026','2026-01-06','2026-01-06 18:15:00',1767698100000,'7,8,4,4,7','78447','97482','34133,85357','43618,20625,56308,68669,45345,60368','1998,6601,4650,4973','1571,3798,3675,1466,2197,2606','354,932,356','50,10,65,12',NULL,'[\"78447\",\"97482\",\"34133,85357\",\"43618,20625,56308,68669,45345,60368\",\"1998,6601,4650,4973\",\"1571,3798,3675,1466,2197,2606\",\"354,932,356\",\"50,10,65,12\"]',2,'2026-01-17 06:35:19','2026-01-17 06:35:19'),
(19,1,'05/01/2026','2026-01-05','2026-01-05 18:15:00',1767611700000,'7,0,5,0,5','70505','05501','48493,16909','18738,29020,86274,90525,03324,31558','7048,4168,1108,5083','5260,2009,1307,7469,7284,2745','525,408,194','47,43,65,27',NULL,'[\"70505\",\"05501\",\"48493,16909\",\"18738,29020,86274,90525,03324,31558\",\"7048,4168,1108,5083\",\"5260,2009,1307,7469,7284,2745\",\"525,408,194\",\"47,43,65,27\"]',2,'2026-01-17 06:35:19','2026-01-17 06:35:19'),
(20,1,'04/01/2026','2026-01-04','2026-01-04 18:15:00',1767525300000,'7,2,3,9,7','72397','89278','16329,48048','97159,17185,89076,75782,16654,21201','1843,2975,4502,1658','8385,1584,4326,7132,5751,8036','239,577,634','68,34,77,25',NULL,'[\"72397\",\"89278\",\"16329,48048\",\"97159,17185,89076,75782,16654,21201\",\"1843,2975,4502,1658\",\"8385,1584,4326,7132,5751,8036\",\"239,577,634\",\"68,34,77,25\"]',2,'2026-01-17 06:35:19','2026-01-17 06:35:19'),
(21,1,'03/01/2026','2026-01-03','2026-01-03 18:15:00',1767438900000,'0,0,9,4,9','00949','15457','85851,82350','69570,81764,65786,46220,74631,60683','4812,4200,2174,3735','6454,1685,1007,6152,1401,3802','512,176,433','46,33,92,48',NULL,'[\"00949\",\"15457\",\"85851,82350\",\"69570,81764,65786,46220,74631,60683\",\"4812,4200,2174,3735\",\"6454,1685,1007,6152,1401,3802\",\"512,176,433\",\"46,33,92,48\"]',2,'2026-01-17 06:35:19','2026-01-17 06:35:19'),
(22,1,'02/01/2026','2026-01-02','2026-01-02 18:15:00',1767352500000,'4,5,7,4,8','45748','11781','80531,23392','76928,84288,38636,47152,36104,66867','0981,5060,0292,2714','5289,9150,7983,5222,5023,9475','641,853,159','29,24,38,22',NULL,'[\"45748\",\"11781\",\"80531,23392\",\"76928,84288,38636,47152,36104,66867\",\"0981,5060,0292,2714\",\"5289,9150,7983,5222,5023,9475\",\"641,853,159\",\"29,24,38,22\"]',2,'2026-01-17 06:35:19','2026-01-17 06:35:19'),
(23,1,'01/01/2026','2026-01-01','2026-01-01 18:15:00',1767266100000,'5,7,0,6,8','57068','42408','08125,48752','87572,04842,46588,59776,95131,80235','1801,6138,3976,3634','7525,4363,7217,8796,5253,7828','731,617,253','91,25,69,67',NULL,'[\"57068\",\"42408\",\"08125,48752\",\"87572,04842,46588,59776,95131,80235\",\"1801,6138,3976,3634\",\"7525,4363,7217,8796,5253,7828\",\"731,617,253\",\"91,25,69,67\"]',2,'2026-01-17 06:35:19','2026-01-17 06:35:19'),
(24,1,'31/12/2025','2025-12-31','2025-12-31 18:15:00',1767179700000,'6,4,9,6,0','64960','23258','73739,12759','58562,64368,35663,69336,07310,45128','8267,5449,0922,6661','3958,5513,9025,6127,9229,6285','341,617,836','78,97,23,44',NULL,'[\"64960\",\"23258\",\"73739,12759\",\"58562,64368,35663,69336,07310,45128\",\"8267,5449,0922,6661\",\"3958,5513,9025,6127,9229,6285\",\"341,617,836\",\"78,97,23,44\"]',2,'2026-01-17 06:35:19','2026-01-17 06:35:19'),
(25,1,'30/12/2025','2025-12-30','2025-12-30 18:15:00',1767093300000,'7,8,3,9,1','78391','61941','39944,67109','40712,88052,03124,42686,30075,40792','3822,8406,8519,0569','4054,1711,3927,8114,2809,3019','682,887,152','53,21,89,03',NULL,'[\"78391\",\"61941\",\"39944,67109\",\"40712,88052,03124,42686,30075,40792\",\"3822,8406,8519,0569\",\"4054,1711,3927,8114,2809,3019\",\"682,887,152\",\"53,21,89,03\"]',2,'2026-01-17 06:35:19','2026-01-17 06:35:19'),
(26,1,'29/12/2025','2025-12-29','2025-12-29 18:15:00',1767006900000,'5,8,4,3,7','58437','44842','10561,49596','98098,91430,49450,05014,90408,45714','4097,8322,3632,3480','3156,1101,5348,7460,2865,8899','691,491,964','49,21,45,58',NULL,'[\"58437\",\"44842\",\"10561,49596\",\"98098,91430,49450,05014,90408,45714\",\"4097,8322,3632,3480\",\"3156,1101,5348,7460,2865,8899\",\"691,491,964\",\"49,21,45,58\"]',2,'2026-01-17 06:35:19','2026-01-17 06:35:19'),
(27,1,'28/12/2025','2025-12-28','2025-12-28 18:15:00',1766920500000,'8,9,9,0,5','89905','15644','64010,86386','50552,61963,39831,86684,33882,06913','8437,5869,7917,2190','8162,2219,4264,0227,6129,4385','151,288,121','93,73,71,65',NULL,'[\"89905\",\"15644\",\"64010,86386\",\"50552,61963,39831,86684,33882,06913\",\"8437,5869,7917,2190\",\"8162,2219,4264,0227,6129,4385\",\"151,288,121\",\"93,73,71,65\"]',2,'2026-01-17 06:35:19','2026-01-17 06:35:19'),
(28,1,'27/12/2025','2025-12-27','2025-12-27 18:15:00',1766834100000,'5,0,9,8,2','50982','00717','59971,36798','33935,36138,63216,88940,24428,85612','4045,2882,9413,7228','9798,2740,7577,5123,7660,2823','720,603,850','70,27,43,21',NULL,'[\"50982\",\"00717\",\"59971,36798\",\"33935,36138,63216,88940,24428,85612\",\"4045,2882,9413,7228\",\"9798,2740,7577,5123,7660,2823\",\"720,603,850\",\"70,27,43,21\"]',2,'2026-01-17 06:35:19','2026-01-17 06:35:19'),
(29,1,'26/12/2025','2025-12-26','2025-12-26 18:15:00',1766747700000,'5,8,6,3,6','58636','75294','24074,60697','82501,05422,17980,04000,24590,89811','6658,0571,0937,6729','9676,3588,7583,6524,3115,8814','798,369,784','45,90,17,28',NULL,'[\"58636\",\"75294\",\"24074,60697\",\"82501,05422,17980,04000,24590,89811\",\"6658,0571,0937,6729\",\"9676,3588,7583,6524,3115,8814\",\"798,369,784\",\"45,90,17,28\"]',2,'2026-01-17 06:35:19','2026-01-17 06:35:19'),
(30,1,'25/12/2025','2025-12-25','2025-12-25 18:15:00',1766661300000,'7,5,1,9,9','75199','30479','69837,38679','94607,07518,53043,50173,86312,12056','5898,1307,7161,9530','2970,3742,1419,7912,2616,6977','049,203,442','69,71,00,37',NULL,'[\"75199\",\"30479\",\"69837,38679\",\"94607,07518,53043,50173,86312,12056\",\"5898,1307,7161,9530\",\"2970,3742,1419,7912,2616,6977\",\"049,203,442\",\"69,71,00,37\"]',2,'2026-01-17 06:35:19','2026-01-17 06:35:19'),
(31,1,'24/12/2025','2025-12-24','2025-12-24 18:15:00',1766574900000,'8,7,6,2,9','87629','82908','31196,72807','12577,61956,80974,98822,33528,50449','2267,1885,4151,8775','6121,3266,8497,0987,5357,3257','752,692,446','99,95,78,80',NULL,'[\"87629\",\"82908\",\"31196,72807\",\"12577,61956,80974,98822,33528,50449\",\"2267,1885,4151,8775\",\"6121,3266,8497,0987,5357,3257\",\"752,692,446\",\"99,95,78,80\"]',2,'2026-01-17 06:35:19','2026-01-17 06:35:19'),
(32,1,'23/12/2025','2025-12-23','2025-12-23 18:15:00',1766488500000,'4,1,0,5,9','41059','52748','17984,24712','46769,75861,49458,62267,57655,54705','6936,1538,1295,7678','5722,2348,9360,2337,6903,7113','724,117,034','98,36,83,81',NULL,'[\"41059\",\"52748\",\"17984,24712\",\"46769,75861,49458,62267,57655,54705\",\"6936,1538,1295,7678\",\"5722,2348,9360,2337,6903,7113\",\"724,117,034\",\"98,36,83,81\"]',2,'2026-01-17 06:35:19','2026-01-17 06:35:19'),
(33,1,'22/12/2025','2025-12-22','2025-12-22 18:15:00',1766402100000,'6,4,4,9,6','64496','80595','07550,19880','99972,89794,13310,69213,93555,14254','2465,9988,3619,0181','4374,0983,0151,7297,5053,7931','492,608,506','80,47,46,45',NULL,'[\"64496\",\"80595\",\"07550,19880\",\"99972,89794,13310,69213,93555,14254\",\"2465,9988,3619,0181\",\"4374,0983,0151,7297,5053,7931\",\"492,608,506\",\"80,47,46,45\"]',2,'2026-01-17 06:35:19','2026-01-17 06:35:19'),
(34,1,'21/12/2025','2025-12-21','2025-12-21 18:15:00',1766315700000,'1,9,0,3,6','19036','39975','08585,16387','58365,20318,40444,28918,94008,43569','0340,9883,0011,3431','4645,1057,4391,9735,5383,3052','514,178,302','99,88,94,17',NULL,'[\"19036\",\"39975\",\"08585,16387\",\"58365,20318,40444,28918,94008,43569\",\"0340,9883,0011,3431\",\"4645,1057,4391,9735,5383,3052\",\"514,178,302\",\"99,88,94,17\"]',2,'2026-01-17 06:35:19','2026-01-17 06:35:19'),
(35,1,'20/12/2025','2025-12-20','2025-12-20 18:15:00',1766229300000,'5,2,8,1,6','52816','76456','05474,57060','42067,04192,00073,07873,03636,84836','1868,9270,1994,2684','4294,0422,2940,5783,9074,9805','133,543,763','90,11,95,61',NULL,'[\"52816\",\"76456\",\"05474,57060\",\"42067,04192,00073,07873,03636,84836\",\"1868,9270,1994,2684\",\"4294,0422,2940,5783,9074,9805\",\"133,543,763\",\"90,11,95,61\"]',2,'2026-01-17 06:35:19','2026-01-17 06:35:19'),
(36,1,'19/12/2025','2025-12-19','2025-12-19 18:15:00',1766142900000,'9,0,3,7,2','90372','32172','86415,91659','31679,25205,10801,54997,51827,83180','8793,3075,1110,9483','7378,3636,9559,1899,9668,8546','021,276,825','28,27,54,56',NULL,'[\"90372\",\"32172\",\"86415,91659\",\"31679,25205,10801,54997,51827,83180\",\"8793,3075,1110,9483\",\"7378,3636,9559,1899,9668,8546\",\"021,276,825\",\"28,27,54,56\"]',2,'2026-01-17 06:35:19','2026-01-17 06:35:19'),
(37,2,'27/12/2025','2025-12-27','2025-12-27 17:15:00',1766830500000,'7,8,8,3,1,9','788319','33216','37997','77373,12316','31241,03148,14611,03268,36585,98029,39862','7445','5652,9004,0415','921','82','[\"788319\",\"33216\",\"37997\",\"77373,12316\",\"31241,03148,14611,03268,36585,98029,39862\",\"7445\",\"5652,9004,0415\",\"921\",\"82\"]',2,'2026-01-17 06:35:25','2026-01-17 06:35:25'),
(38,2,'20/12/2025','2025-12-20','2025-12-20 17:15:00',1766225700000,'4,7,3,1,4,5','473145','79823','01588','54299,10865','33236,79712,98836,33130,00475,52437,95874','1308','6897,2574,4736','179','27','[\"473145\",\"79823\",\"01588\",\"54299,10865\",\"33236,79712,98836,33130,00475,52437,95874\",\"1308\",\"6897,2574,4736\",\"179\",\"27\"]',2,'2026-01-17 06:35:25','2026-01-17 06:35:25'),
(39,2,'13/12/2025','2025-12-13','2025-12-13 17:15:00',1765620900000,'5,4,7,8,3,7','547837','10077','10219','29981,22997','96311,43899,96040,07371,26868,01186,58981','7315','6678,7289,1344','911','37','[\"547837\",\"10077\",\"10219\",\"29981,22997\",\"96311,43899,96040,07371,26868,01186,58981\",\"7315\",\"6678,7289,1344\",\"911\",\"37\"]',2,'2026-01-17 06:35:25','2026-01-17 06:35:25'),
(40,2,'06/12/2025','2025-12-06','2025-12-06 17:15:00',1765016100000,'6,8,3,3,9,7','683397','34540','70736','43696,25095','47728,61577,67252,43866,09463,93927,41322','4184','9151,2565,8287','749','63','[\"683397\",\"34540\",\"70736\",\"43696,25095\",\"47728,61577,67252,43866,09463,93927,41322\",\"4184\",\"9151,2565,8287\",\"749\",\"63\"]',2,'2026-01-17 06:35:25','2026-01-17 06:35:25'),
(41,2,'29/11/2025','2025-11-29','2025-11-29 17:15:00',1764411300000,'3,5,9,1,3,6','359136','67989','46562','34728,75129','02008,33259,71588,05149,27704,02314,48054','8253','2081,5565,2606','524','06','[\"359136\",\"67989\",\"46562\",\"34728,75129\",\"02008,33259,71588,05149,27704,02314,48054\",\"8253\",\"2081,5565,2606\",\"524\",\"06\"]',2,'2026-01-17 06:35:25','2026-01-17 06:35:25'),
(42,2,'22/11/2025','2025-11-22','2025-11-22 17:15:00',1763806500000,'7,3,2,3,9,7','732397','26784','76106','43937,35367','76884,59842,63365,39958,71237,78187,88305','6252','2118,9909,9568','980','10','[\"732397\",\"26784\",\"76106\",\"43937,35367\",\"76884,59842,63365,39958,71237,78187,88305\",\"6252\",\"2118,9909,9568\",\"980\",\"10\"]',2,'2026-01-17 06:35:25','2026-01-17 06:35:25'),
(43,2,'15/11/2025','2025-11-15','2025-11-15 17:15:00',1763201700000,'4,6,8,1,4,5','468145','49656','85877','10486,86137','51606,66663,96860,94876,65991,89961,79532','3415','5790,7512,4511','479','49','[\"468145\",\"49656\",\"85877\",\"10486,86137\",\"51606,66663,96860,94876,65991,89961,79532\",\"3415\",\"5790,7512,4511\",\"479\",\"49\"]',2,'2026-01-17 06:35:25','2026-01-17 06:35:25'),
(44,2,'08/11/2025','2025-11-08','2025-11-08 17:15:00',1762596900000,'1,5,8,9,3,8','158938','31286','90433','13283,88258','15365,69705,54865,93244,74438,35291,57933','8946','1850,9777,7791','839','33','[\"158938\",\"31286\",\"90433\",\"13283,88258\",\"15365,69705,54865,93244,74438,35291,57933\",\"8946\",\"1850,9777,7791\",\"839\",\"33\"]',2,'2026-01-17 06:35:25','2026-01-17 06:35:25'),
(45,2,'01/11/2025','2025-11-01','2025-11-01 17:15:00',1761992100000,'6,9,1,9,8,1','691981','16160','30276','92652,42058','23403,15511,45150,55346,24912,02865,13970','3771','2567,3174,1098','739','53','[\"691981\",\"16160\",\"30276\",\"92652,42058\",\"23403,15511,45150,55346,24912,02865,13970\",\"3771\",\"2567,3174,1098\",\"739\",\"53\"]',2,'2026-01-17 06:35:25','2026-01-17 06:35:25'),
(46,2,'25/10/2025','2025-10-25','2025-10-25 17:15:00',1761387300000,'0,1,7,2,0,1','017201','06437','23645','31965,37145','24888,20986,53807,04551,81350,88886,85393','0261','4979,8213,9323','963','97','[\"017201\",\"06437\",\"23645\",\"31965,37145\",\"24888,20986,53807,04551,81350,88886,85393\",\"0261\",\"4979,8213,9323\",\"963\",\"97\"]',2,'2026-01-17 06:35:25','2026-01-17 06:35:25'),
(47,2,'18/10/2025','2025-10-18','2025-10-18 17:15:00',1760782500000,'9,6,7,9,1,4','967914','55262','25407','51312,98600','07518,47310,68539,26795,70945,70563,81905','9566','1167,8349,3007','316','44','[\"967914\",\"55262\",\"25407\",\"51312,98600\",\"07518,47310,68539,26795,70945,70563,81905\",\"9566\",\"1167,8349,3007\",\"316\",\"44\"]',2,'2026-01-17 06:35:25','2026-01-17 06:35:25'),
(48,2,'11/10/2025','2025-10-11','2025-10-11 17:15:00',1760177700000,'7,7,9,4,0,4','779404','22827','08089','21083,44623','46629,88614,03946,64426,01501,67532,30926','7877','3010,8127,0100','157','53','[\"779404\",\"22827\",\"08089\",\"21083,44623\",\"46629,88614,03946,64426,01501,67532,30926\",\"7877\",\"3010,8127,0100\",\"157\",\"53\"]',2,'2026-01-17 06:35:25','2026-01-17 06:35:25'),
(49,2,'04/10/2025','2025-10-04','2025-10-04 17:15:00',1759572900000,'1,9,7,6,6,6','197666','28622','54541','85926,52879','92377,61878,02876,61467,59555,90190,22882','9502','7484,5569,2165','702','89','[\"197666\",\"28622\",\"54541\",\"85926,52879\",\"92377,61878,02876,61467,59555,90190,22882\",\"9502\",\"7484,5569,2165\",\"702\",\"89\"]',2,'2026-01-17 06:35:25','2026-01-17 06:35:25'),
(50,2,'27/09/2025','2025-09-27','2025-09-27 17:15:00',1758968100000,'1,8,9,4,8,1','189481','32283','70634','10271,29180','02609,77771,62337,25176,56058,26040,92983','5200','3477,8997,1196','910','74','[\"189481\",\"32283\",\"70634\",\"10271,29180\",\"02609,77771,62337,25176,56058,26040,92983\",\"5200\",\"3477,8997,1196\",\"910\",\"74\"]',2,'2026-01-17 06:35:25','2026-01-17 06:35:25'),
(51,2,'20/09/2025','2025-09-20','2025-09-20 17:15:00',1758363300000,'9,8,3,1,8,2','983182','63501','31048','15869,73717','88663,49340,24331,06081,79863,72852,74351','9159','0529,3888,1175','525','81','[\"983182\",\"63501\",\"31048\",\"15869,73717\",\"88663,49340,24331,06081,79863,72852,74351\",\"9159\",\"0529,3888,1175\",\"525\",\"81\"]',2,'2026-01-17 06:35:25','2026-01-17 06:35:25'),
(52,2,'13/09/2025','2025-09-13','2025-09-13 17:15:00',1757758500000,'1,2,7,8,3,5','127835','23517','64828','12318,94573','54260,67183,36860,39139,73093,87769,93903','5601','7626,7183,4156','515','07','[\"127835\",\"23517\",\"64828\",\"12318,94573\",\"54260,67183,36860,39139,73093,87769,93903\",\"5601\",\"7626,7183,4156\",\"515\",\"07\"]',2,'2026-01-17 06:35:25','2026-01-17 06:35:25'),
(53,2,'06/09/2025','2025-09-06','2025-09-06 17:15:00',1757153700000,'5,7,9,1,6,9','579169','90733','00191','99259,48424','46336,90247,39282,46639,97127,20975,94276','6858','4459,9312,6594','301','96','[\"579169\",\"90733\",\"00191\",\"99259,48424\",\"46336,90247,39282,46639,97127,20975,94276\",\"6858\",\"4459,9312,6594\",\"301\",\"96\"]',2,'2026-01-17 06:35:25','2026-01-17 06:35:25'),
(54,2,'30/08/2025','2025-08-30','2025-08-30 17:15:00',1756548900000,'0,2,7,4,4,4','027444','62113','80408','30208,63718','88282,09400,61668,26450,16040,59145,16907','6485','6686,2725,1367','815','60','[\"027444\",\"62113\",\"80408\",\"30208,63718\",\"88282,09400,61668,26450,16040,59145,16907\",\"6485\",\"6686,2725,1367\",\"815\",\"60\"]',2,'2026-01-17 06:35:25','2026-01-17 06:35:25'),
(55,2,'23/08/2025','2025-08-23','2025-08-23 17:15:00',1755944100000,'8,0,3,3,3,4','803334','95751','48084','10090,64335','34183,29228,07936,65085,99197,96461,34215','8999','4062,3427,1800','117','84','[\"803334\",\"95751\",\"48084\",\"10090,64335\",\"34183,29228,07936,65085,99197,96461,34215\",\"8999\",\"4062,3427,1800\",\"117\",\"84\"]',2,'2026-01-17 06:35:25','2026-01-17 06:35:25'),
(56,2,'16/08/2025','2025-08-16','2025-08-16 17:15:00',1755339300000,'0,9,7,5,6,2','097562','35985','60436','55017,71344','15888,43959,11248,27048,79708,68768,52132','6374','7697,2929,9143','466','84','[\"097562\",\"35985\",\"60436\",\"55017,71344\",\"15888,43959,11248,27048,79708,68768,52132\",\"6374\",\"7697,2929,9143\",\"466\",\"84\"]',2,'2026-01-17 06:35:25','2026-01-17 06:35:25'),
(57,2,'09/08/2025','2025-08-09','2025-08-09 17:15:00',1754734500000,'3,7,2,1,2,8','372128','86817','84725','96774,18183','16349,02721,97250,26004,21333,90736,84502','7755','1437,8575,2544','781','33','[\"372128\",\"86817\",\"84725\",\"96774,18183\",\"16349,02721,97250,26004,21333,90736,84502\",\"7755\",\"1437,8575,2544\",\"781\",\"33\"]',2,'2026-01-17 06:35:25','2026-01-17 06:35:25'),
(58,2,'02/08/2025','2025-08-02','2025-08-02 17:15:00',1754129700000,'3,3,5,2,4,0','335240','29683','65993','05819,47553','93325,28917,52601,15700,10273,46975,91951','1455','1838,7218,6958','604','09','[\"335240\",\"29683\",\"65993\",\"05819,47553\",\"93325,28917,52601,15700,10273,46975,91951\",\"1455\",\"1838,7218,6958\",\"604\",\"09\"]',2,'2026-01-17 06:35:25','2026-01-17 06:35:25'),
(59,2,'26/07/2025','2025-07-26','2025-07-26 17:15:00',1753524900000,'0,5,3,4,8,1','053481','05967','76315','71439,81137','40712,32558,10481,73534,46751,30494,59905','1947','2876,9335,0754','872','93','[\"053481\",\"05967\",\"76315\",\"71439,81137\",\"40712,32558,10481,73534,46751,30494,59905\",\"1947\",\"2876,9335,0754\",\"872\",\"93\"]',2,'2026-01-17 06:35:25','2026-01-17 06:35:25'),
(60,2,'19/07/2025','2025-07-19','2025-07-19 17:15:00',1752920100000,'1,5,0,5,5,3','150553','49178','59704','60909,67749','77811,79188,88954,23990,35478,83560,51021','8340','6206,3701,3980','719','11','[\"150553\",\"49178\",\"59704\",\"60909,67749\",\"77811,79188,88954,23990,35478,83560,51021\",\"8340\",\"6206,3701,3980\",\"719\",\"11\"]',2,'2026-01-17 06:35:25','2026-01-17 06:35:25'),
(61,2,'12/07/2025','2025-07-12','2025-07-12 17:15:00',1752315300000,'5,5,2,4,7,4','552474','92184','42913','12445,16827','26397,78728,52177,77020,23112,26228,25150','8502','1472,2656,7649','847','54','[\"552474\",\"92184\",\"42913\",\"12445,16827\",\"26397,78728,52177,77020,23112,26228,25150\",\"8502\",\"1472,2656,7649\",\"847\",\"54\"]',2,'2026-01-17 06:35:25','2026-01-17 06:35:25'),
(62,2,'05/07/2025','2025-07-05','2025-07-05 17:15:00',1751710500000,'0,6,4,1,9,5','064195','87708','92211','45721,05771','87390,60315,24871,58107,07595,27018,10370','7934','4597,1670,3895','396','13','[\"064195\",\"87708\",\"92211\",\"45721,05771\",\"87390,60315,24871,58107,07595,27018,10370\",\"7934\",\"4597,1670,3895\",\"396\",\"13\"]',2,'2026-01-17 06:35:25','2026-01-17 06:35:25'),
(63,2,'28/06/2025','2025-06-28','2025-06-28 17:15:00',1751105700000,'7,7,0,8,4,4','770844','51900','32808','25379,91970','38798,48904,22947,83879,62717,81200,65459','1414','7096,6645,2839','573','29','[\"770844\",\"51900\",\"32808\",\"25379,91970\",\"38798,48904,22947,83879,62717,81200,65459\",\"1414\",\"7096,6645,2839\",\"573\",\"29\"]',2,'2026-01-17 06:35:25','2026-01-17 06:35:25'),
(64,3,'17/01/2026','2026-01-17','2026-01-17 17:15:00',1768644900000,'3,7,8,3,4,7','378347','07644','36582','63688,16529','23129,79841,34372,09399,58888,18273,10167','3789','5333,6848,7903','209','76','[\"378347\",\"07644\",\"36582\",\"63688,16529\",\"23129,79841,34372,09399,58888,18273,10167\",\"3789\",\"5333,6848,7903\",\"209\",\"76\"]',2,'2026-01-17 06:35:26','2026-01-17 06:35:26'),
(65,3,'14/01/2026','2026-01-14','2026-01-14 17:15:00',1768385700000,'1,2,6,7,0,4','126704','49417','39388','00504,43301','17079,89187,89106,80598,55760,01088,51414','4425','2974,6022,6651','310','74','[\"126704\",\"49417\",\"39388\",\"00504,43301\",\"17079,89187,89106,80598,55760,01088,51414\",\"4425\",\"2974,6022,6651\",\"310\",\"74\"]',2,'2026-01-17 06:35:26','2026-01-17 06:35:26'),
(66,3,'10/01/2026','2026-01-10','2026-01-10 17:15:00',1768040100000,'0,5,8,1,3,3','058133','20826','56630','27335,24502','04228,74987,59056,95219,82991,18453,18311','1368','4213,4612,3139','060','61','[\"058133\",\"20826\",\"56630\",\"27335,24502\",\"04228,74987,59056,95219,82991,18453,18311\",\"1368\",\"4213,4612,3139\",\"060\",\"61\"]',2,'2026-01-17 06:35:26','2026-01-17 06:35:26'),
(67,3,'07/01/2026','2026-01-07','2026-01-07 17:15:00',1767780900000,'8,0,8,5,5,7','808557','12762','52429','87698,10592','10279,00512,54276,75998,36564,64242,26811','4643','0463,2876,8084','857','53','[\"808557\",\"12762\",\"52429\",\"87698,10592\",\"10279,00512,54276,75998,36564,64242,26811\",\"4643\",\"0463,2876,8084\",\"857\",\"53\"]',2,'2026-01-17 06:35:26','2026-01-17 06:35:26'),
(68,3,'03/01/2026','2026-01-03','2026-01-03 17:15:00',1767435300000,'9,0,7,7,7,6','907776','06280','82629','08075,21532','30549,10651,72866,46500,52122,65173,49693','7026','9853,6325,7200','976','90','[\"907776\",\"06280\",\"82629\",\"08075,21532\",\"30549,10651,72866,46500,52122,65173,49693\",\"7026\",\"9853,6325,7200\",\"976\",\"90\"]',2,'2026-01-17 06:35:26','2026-01-17 06:35:26'),
(69,3,'31/12/2025','2025-12-31','2025-12-31 17:15:00',1767176100000,'1,3,0,0,8,2','130082','72361','76835','72337,51954','29240,81190,52415,36447,75290,12386,97648','4679','4792,9455,5951','413','15','[\"130082\",\"72361\",\"76835\",\"72337,51954\",\"29240,81190,52415,36447,75290,12386,97648\",\"4679\",\"4792,9455,5951\",\"413\",\"15\"]',2,'2026-01-17 06:35:26','2026-01-17 06:35:26'),
(70,3,'27/12/2025','2025-12-27','2025-12-27 17:15:00',1766830500000,'1,3,3,0,1,3','133013','11343','08995','24580,22237','86601,10843,61857,30091,59463,52280,27730','3671','1924,8837,3648','025','38','[\"133013\",\"11343\",\"08995\",\"24580,22237\",\"86601,10843,61857,30091,59463,52280,27730\",\"3671\",\"1924,8837,3648\",\"025\",\"38\"]',2,'2026-01-17 06:35:26','2026-01-17 06:35:26'),
(71,3,'24/12/2025','2025-12-24','2025-12-24 17:15:00',1766571300000,'2,4,6,7,0,0','246700','26600','17768','28107,13038','22976,76997,89520,33716,28415,50908,98267','5084','4817,7163,0534','030','61','[\"246700\",\"26600\",\"17768\",\"28107,13038\",\"22976,76997,89520,33716,28415,50908,98267\",\"5084\",\"4817,7163,0534\",\"030\",\"61\"]',2,'2026-01-17 06:35:26','2026-01-17 06:35:26'),
(72,3,'20/12/2025','2025-12-20','2025-12-20 17:15:00',1766225700000,'3,8,4,2,8,8','384288','12377','79812','16662,13379','33090,83053,53149,05825,04387,02662,68713','3701','8309,3670,9085','777','40','[\"384288\",\"12377\",\"79812\",\"16662,13379\",\"33090,83053,53149,05825,04387,02662,68713\",\"3701\",\"8309,3670,9085\",\"777\",\"40\"]',2,'2026-01-17 06:35:26','2026-01-17 06:35:26'),
(73,3,'17/12/2025','2025-12-17','2025-12-17 17:15:00',1765966500000,'1,3,3,5,0,2','133502','11394','72954','30884,36797','62654,59625,89124,08746,44270,26343,37806','6241','2052,8615,6704','546','65','[\"133502\",\"11394\",\"72954\",\"30884,36797\",\"62654,59625,89124,08746,44270,26343,37806\",\"6241\",\"2052,8615,6704\",\"546\",\"65\"]',2,'2026-01-17 06:35:26','2026-01-17 06:35:26'),
(74,3,'13/12/2025','2025-12-13','2025-12-13 17:15:00',1765620900000,'8,7,6,9,2,3','876923','71110','30181','51992,51019','60904,00458,65606,87636,50667,57522,30077','0394','4349,7931,4101','061','59','[\"876923\",\"71110\",\"30181\",\"51992,51019\",\"60904,00458,65606,87636,50667,57522,30077\",\"0394\",\"4349,7931,4101\",\"061\",\"59\"]',2,'2026-01-17 06:35:26','2026-01-17 06:35:26'),
(75,3,'10/12/2025','2025-12-10','2025-12-10 17:15:00',1765361700000,'2,2,9,7,7,1','229771','98716','96365','95109,12109','41607,33304,61032,34858,76202,77084,13488','1082','3893,0262,4154','183','29','[\"229771\",\"98716\",\"96365\",\"95109,12109\",\"41607,33304,61032,34858,76202,77084,13488\",\"1082\",\"3893,0262,4154\",\"183\",\"29\"]',2,'2026-01-17 06:35:26','2026-01-17 06:35:26'),
(76,3,'06/12/2025','2025-12-06','2025-12-06 17:15:00',1765016100000,'4,1,9,4,9,9','419499','84676','45487','21838,43842','48171,73902,95989,95624,63928,68031,36060','9021','9519,9641,3770','699','82','[\"419499\",\"84676\",\"45487\",\"21838,43842\",\"48171,73902,95989,95624,63928,68031,36060\",\"9021\",\"9519,9641,3770\",\"699\",\"82\"]',2,'2026-01-17 06:35:26','2026-01-17 06:35:26'),
(77,3,'03/12/2025','2025-12-03','2025-12-03 17:15:00',1764756900000,'0,9,0,7,4,1','090741','46623','49091','69480,35014','66780,61198,48209,91042,09852,93043,52727','6991','7044,3687,1065','964','22','[\"090741\",\"46623\",\"49091\",\"69480,35014\",\"66780,61198,48209,91042,09852,93043,52727\",\"6991\",\"7044,3687,1065\",\"964\",\"22\"]',2,'2026-01-17 06:35:26','2026-01-17 06:35:26'),
(78,3,'29/11/2025','2025-11-29','2025-11-29 17:15:00',1764411300000,'8,2,6,7,0,1','826701','20238','41319','58486,27862','86929,73392,43834,37344,08491,16899,76879','1378','3020,5284,7395','606','12','[\"826701\",\"20238\",\"41319\",\"58486,27862\",\"86929,73392,43834,37344,08491,16899,76879\",\"1378\",\"3020,5284,7395\",\"606\",\"12\"]',2,'2026-01-17 06:35:26','2026-01-17 06:35:26'),
(79,3,'26/11/2025','2025-11-26','2025-11-26 17:15:00',1764152100000,'1,1,4,3,6,4','114364','06461','68415','94540,22665','94990,61186,60092,49496,75978,51033,69633','0027','6588,5115,0632','293','06','[\"114364\",\"06461\",\"68415\",\"94540,22665\",\"94990,61186,60092,49496,75978,51033,69633\",\"0027\",\"6588,5115,0632\",\"293\",\"06\"]',2,'2026-01-17 06:35:26','2026-01-17 06:35:26'),
(80,3,'22/11/2025','2025-11-22','2025-11-22 17:15:00',1763806500000,'7,8,0,8,1,3','780813','15019','15141','59860,14341','98703,68583,09271,28118,06303,05219,84416','9704','3139,8524,0679','314','38','[\"780813\",\"15019\",\"15141\",\"59860,14341\",\"98703,68583,09271,28118,06303,05219,84416\",\"9704\",\"3139,8524,0679\",\"314\",\"38\"]',2,'2026-01-17 06:35:26','2026-01-17 06:35:26'),
(81,3,'19/11/2025','2025-11-19','2025-11-19 17:15:00',1763547300000,'5,8,8,2,5,7','588257','32079','05092','30342,71614','82557,21959,09655,63767,86367,40316,61811','5818','2915,6014,7345','806','19','[\"588257\",\"32079\",\"05092\",\"30342,71614\",\"82557,21959,09655,63767,86367,40316,61811\",\"5818\",\"2915,6014,7345\",\"806\",\"19\"]',2,'2026-01-17 06:35:26','2026-01-17 06:35:26'),
(82,3,'15/11/2025','2025-11-15','2025-11-15 17:15:00',1763201700000,'2,0,8,1,9,7','208197','00310','64702','32620,30663','68600,62017,99282,88007,76079,66433,10574','9545','4689,2496,6781','165','46','[\"208197\",\"00310\",\"64702\",\"32620,30663\",\"68600,62017,99282,88007,76079,66433,10574\",\"9545\",\"4689,2496,6781\",\"165\",\"46\"]',2,'2026-01-17 06:35:26','2026-01-17 06:35:26'),
(83,3,'12/11/2025','2025-11-12','2025-11-12 17:15:00',1762942500000,'8,2,9,5,2,4','829524','46414','80352','06355,20825','41069,87559,80551,98912,27551,15060,76288','4719','6627,1532,2991','375','46','[\"829524\",\"46414\",\"80352\",\"06355,20825\",\"41069,87559,80551,98912,27551,15060,76288\",\"4719\",\"6627,1532,2991\",\"375\",\"46\"]',2,'2026-01-17 06:35:26','2026-01-17 06:35:26'),
(84,3,'08/11/2025','2025-11-08','2025-11-08 17:15:00',1762596900000,'3,0,8,8,2,1','308821','78478','44309','08329,71854','32193,82718,77279,50116,59568,13258,85590','8519','2903,4687,8132','881','97','[\"308821\",\"78478\",\"44309\",\"08329,71854\",\"32193,82718,77279,50116,59568,13258,85590\",\"8519\",\"2903,4687,8132\",\"881\",\"97\"]',2,'2026-01-17 06:35:26','2026-01-17 06:35:26'),
(85,3,'05/11/2025','2025-11-05','2025-11-05 17:15:00',1762337700000,'0,3,9,7,0,1','039701','73469','78937','40495,53848','56152,82373,65845,94444,73546,73178,52924','5621','4019,8420,5984','351','14','[\"039701\",\"73469\",\"78937\",\"40495,53848\",\"56152,82373,65845,94444,73546,73178,52924\",\"5621\",\"4019,8420,5984\",\"351\",\"14\"]',2,'2026-01-17 06:35:26','2026-01-17 06:35:26'),
(86,3,'01/11/2025','2025-11-01','2025-11-01 17:15:00',1761992100000,'0,3,6,6,6,4','036664','25541','57256','14831,05096','57179,19668,14519,82796,46235,61152,03912','8207','9589,6218,5218','210','33','[\"036664\",\"25541\",\"57256\",\"14831,05096\",\"57179,19668,14519,82796,46235,61152,03912\",\"8207\",\"9589,6218,5218\",\"210\",\"33\"]',2,'2026-01-17 06:35:26','2026-01-17 06:35:26'),
(87,3,'29/10/2025','2025-10-29','2025-10-29 17:15:00',1761732900000,'5,1,8,9,3,5','518935','00490','98114','08668,07628','74587,89339,91255,58664,88058,54031,82352','8536','1471,0565,0555','333','36','[\"518935\",\"00490\",\"98114\",\"08668,07628\",\"74587,89339,91255,58664,88058,54031,82352\",\"8536\",\"1471,0565,0555\",\"333\",\"36\"]',2,'2026-01-17 06:35:26','2026-01-17 06:35:26'),
(88,3,'25/10/2025','2025-10-25','2025-10-25 17:15:00',1761387300000,'9,1,2,9,1,6','912916','38634','11659','19317,65522','84792,28813,60244,81916,48895,73800,55376','9303','1396,1308,9391','002','66','[\"912916\",\"38634\",\"11659\",\"19317,65522\",\"84792,28813,60244,81916,48895,73800,55376\",\"9303\",\"1396,1308,9391\",\"002\",\"66\"]',2,'2026-01-17 06:35:26','2026-01-17 06:35:26'),
(89,3,'22/10/2025','2025-10-22','2025-10-22 17:15:00',1761128100000,'5,9,5,2,7,0','595270','74276','36975','33262,97280','74059,04885,55272,55641,64655,80724,55667','2658','5574,4781,6233','723','57','[\"595270\",\"74276\",\"36975\",\"33262,97280\",\"74059,04885,55272,55641,64655,80724,55667\",\"2658\",\"5574,4781,6233\",\"723\",\"57\"]',2,'2026-01-17 06:35:26','2026-01-17 06:35:26'),
(90,3,'18/10/2025','2025-10-18','2025-10-18 17:15:00',1760782500000,'4,9,0,3,5,3','490353','36487','56029','52826,50759','60265,06461,87079,38026,00955,21715,58669','2229','5127,3709,2130','991','59','[\"490353\",\"36487\",\"56029\",\"52826,50759\",\"60265,06461,87079,38026,00955,21715,58669\",\"2229\",\"5127,3709,2130\",\"991\",\"59\"]',2,'2026-01-17 06:35:26','2026-01-17 06:35:26'),
(91,3,'15/10/2025','2025-10-15','2025-10-15 17:15:00',1760523300000,'3,0,8,2,4,2','308242','19488','69041','48567,95082','70235,71897,81624,12715,42505,09122,15846','1005','5869,4378,0151','029','41','[\"308242\",\"19488\",\"69041\",\"48567,95082\",\"70235,71897,81624,12715,42505,09122,15846\",\"1005\",\"5869,4378,0151\",\"029\",\"41\"]',2,'2026-01-17 06:35:26','2026-01-17 06:35:26'),
(92,3,'11/10/2025','2025-10-11','2025-10-11 17:15:00',1760177700000,'6,3,6,6,7,4','636674','65875','69662','62559,23972','81558,37828,99063,81947,99293,63003,14249','4706','9473,8936,2288','017','15','[\"636674\",\"65875\",\"69662\",\"62559,23972\",\"81558,37828,99063,81947,99293,63003,14249\",\"4706\",\"9473,8936,2288\",\"017\",\"15\"]',2,'2026-01-17 06:35:26','2026-01-17 06:35:26'),
(93,3,'08/10/2025','2025-10-08','2025-10-08 17:15:00',1759918500000,'5,5,4,4,8,7','554487','21550','10291','03077,86284','03389,89572,56482,67877,71642,40429,76367','2521','2091,7973,2836','562','83','[\"554487\",\"21550\",\"10291\",\"03077,86284\",\"03389,89572,56482,67877,71642,40429,76367\",\"2521\",\"2091,7973,2836\",\"562\",\"83\"]',2,'2026-01-17 06:35:26','2026-01-17 06:35:26'),
(94,10,'14/01/2026','2026-01-14','2026-01-14 17:15:00',1768385700000,'5,0,7,4,5,0','507450','07369','48368','26379,13701','81666,12209,10607,40411,91149,17102,53891','0119','9774,2198,0454','768','66','[\"507450\",\"07369\",\"48368\",\"26379,13701\",\"81666,12209,10607,40411,91149,17102,53891\",\"0119\",\"9774,2198,0454\",\"768\",\"66\"]',2,'2026-01-17 06:35:26','2026-01-17 06:35:26'),
(95,10,'11/01/2026','2026-01-11','2026-01-11 17:15:00',1768126500000,'9,3,5,8,4,6','935846','15456','27441','64417,92083','05661,00812,87685,24796,88592,38096,60001','8551','9299,0875,8511','993','37','[\"935846\",\"15456\",\"27441\",\"64417,92083\",\"05661,00812,87685,24796,88592,38096,60001\",\"8551\",\"9299,0875,8511\",\"993\",\"37\"]',2,'2026-01-17 06:35:26','2026-01-17 06:35:26'),
(96,10,'07/01/2026','2026-01-07','2026-01-07 17:15:00',1767780900000,'3,1,9,1,8,0','319180','75304','48909','60843,65029','82796,88451,65833,77339,10252,08041,05535','2222','0440,9937,7105','561','76','[\"319180\",\"75304\",\"48909\",\"60843,65029\",\"82796,88451,65833,77339,10252,08041,05535\",\"2222\",\"0440,9937,7105\",\"561\",\"76\"]',2,'2026-01-17 06:35:26','2026-01-17 06:35:26'),
(97,10,'04/01/2026','2026-01-04','2026-01-04 17:15:00',1767521700000,'6,3,1,2,6,7','631267','36948','28172','58521,79545','73304,80770,64453,62693,18789,68081,54978','2984','7098,1188,9957','942','27','[\"631267\",\"36948\",\"28172\",\"58521,79545\",\"73304,80770,64453,62693,18789,68081,54978\",\"2984\",\"7098,1188,9957\",\"942\",\"27\"]',2,'2026-01-17 06:35:26','2026-01-17 06:35:26'),
(98,10,'31/12/2025','2025-12-31','2025-12-31 17:15:00',1767176100000,'0,8,5,1,4,1','085141','77824','88639','21007,54221','07252,69034,71393,78812,68039,28186,85187','0009','2609,5732,2842','918','33','[\"085141\",\"77824\",\"88639\",\"21007,54221\",\"07252,69034,71393,78812,68039,28186,85187\",\"0009\",\"2609,5732,2842\",\"918\",\"33\"]',2,'2026-01-17 06:35:26','2026-01-17 06:35:26'),
(99,10,'28/12/2025','2025-12-28','2025-12-28 17:15:00',1766916900000,'1,0,9,0,5,9','109059','20657','02336','70820,65052','30620,57108,10116,22870,60547,88580,52183','9167','9136,1571,9282','280','46','[\"109059\",\"20657\",\"02336\",\"70820,65052\",\"30620,57108,10116,22870,60547,88580,52183\",\"9167\",\"9136,1571,9282\",\"280\",\"46\"]',2,'2026-01-17 06:35:26','2026-01-17 06:35:26'),
(100,10,'24/12/2025','2025-12-24','2025-12-24 17:15:00',1766571300000,'2,4,2,3,4,0','242340','18236','86205','54151,04951','70035,40526,08598,79536,40954,78990,87543','7694','5146,9169,2859','632','35','[\"242340\",\"18236\",\"86205\",\"54151,04951\",\"70035,40526,08598,79536,40954,78990,87543\",\"7694\",\"5146,9169,2859\",\"632\",\"35\"]',2,'2026-01-17 06:35:26','2026-01-17 06:35:26'),
(101,10,'21/12/2025','2025-12-21','2025-12-21 17:15:00',1766312100000,'1,9,5,4,9,2','195492','30283','03932','41801,58676','28777,37737,12315,18111,81567,64289,21663','2794','7784,7454,6921','106','55','[\"195492\",\"30283\",\"03932\",\"41801,58676\",\"28777,37737,12315,18111,81567,64289,21663\",\"2794\",\"7784,7454,6921\",\"106\",\"55\"]',2,'2026-01-17 06:35:26','2026-01-17 06:35:26'),
(102,10,'17/12/2025','2025-12-17','2025-12-17 17:15:00',1765966500000,'3,9,7,4,3,2','397432','37823','31234','20839,94537','27797,82126,85824,53525,70486,23580,95786','4127','8558,0737,1602','656','59','[\"397432\",\"37823\",\"31234\",\"20839,94537\",\"27797,82126,85824,53525,70486,23580,95786\",\"4127\",\"8558,0737,1602\",\"656\",\"59\"]',2,'2026-01-17 06:35:26','2026-01-17 06:35:26'),
(103,10,'14/12/2025','2025-12-14','2025-12-14 17:15:00',1765707300000,'9,1,8,4,0,5','918405','41467','13455','48771,90305','15278,41804,23946,95321,95464,53315,24046','3689','8275,9814,7952','924','35','[\"918405\",\"41467\",\"13455\",\"48771,90305\",\"15278,41804,23946,95321,95464,53315,24046\",\"3689\",\"8275,9814,7952\",\"924\",\"35\"]',2,'2026-01-17 06:35:26','2026-01-17 06:35:26'),
(104,10,'10/12/2025','2025-12-10','2025-12-10 17:15:00',1765361700000,'5,4,2,2,3,1','542231','78008','56237','50033,54385','94107,46570,50868,73507,15360,73025,19559','6888','4448,3686,9169','727','32','[\"542231\",\"78008\",\"56237\",\"50033,54385\",\"94107,46570,50868,73507,15360,73025,19559\",\"6888\",\"4448,3686,9169\",\"727\",\"32\"]',2,'2026-01-17 06:35:26','2026-01-17 06:35:26'),
(105,10,'07/12/2025','2025-12-07','2025-12-07 17:15:00',1765102500000,'7,1,0,1,4,6','710146','02739','83588','78796,57634','50492,87777,40143,15144,18669,78491,11858','2541','0281,8035,8570','958','67','[\"710146\",\"02739\",\"83588\",\"78796,57634\",\"50492,87777,40143,15144,18669,78491,11858\",\"2541\",\"0281,8035,8570\",\"958\",\"67\"]',2,'2026-01-17 06:35:26','2026-01-17 06:35:26'),
(106,10,'03/12/2025','2025-12-03','2025-12-03 17:15:00',1764756900000,'2,5,9,3,5,1','259351','61358','76803','85371,80242','53677,73766,98832,49176,99955,62246,92448','2481','0809,1761,1117','161','70','[\"259351\",\"61358\",\"76803\",\"85371,80242\",\"53677,73766,98832,49176,99955,62246,92448\",\"2481\",\"0809,1761,1117\",\"161\",\"70\"]',2,'2026-01-17 06:35:26','2026-01-17 06:35:26'),
(107,10,'30/11/2025','2025-11-30','2025-11-30 17:15:00',1764497700000,'1,1,1,8,9,0','111890','83054','42773','25903,04051','28606,54979,97440,96453,34971,21360,57742','7875','7055,1710,4640','687','50','[\"111890\",\"83054\",\"42773\",\"25903,04051\",\"28606,54979,97440,96453,34971,21360,57742\",\"7875\",\"7055,1710,4640\",\"687\",\"50\"]',2,'2026-01-17 06:35:26','2026-01-17 06:35:26'),
(108,10,'26/11/2025','2025-11-26','2025-11-26 17:15:00',1764152100000,'2,8,1,9,7,7','281977','05830','67886','48060,12915','44197,90840,63074,68953,21795,92659,99317','4411','4192,1618,4918','553','14','[\"281977\",\"05830\",\"67886\",\"48060,12915\",\"44197,90840,63074,68953,21795,92659,99317\",\"4411\",\"4192,1618,4918\",\"553\",\"14\"]',2,'2026-01-17 06:35:26','2026-01-17 06:35:26'),
(109,10,'23/11/2025','2025-11-23','2025-11-23 17:15:00',1763892900000,'3,8,4,2,1,1','384211','78244','94144','01904,85150','21453,13066,05456,17320,98041,78903,43526','3054','5768,9507,0282','115','13','[\"384211\",\"78244\",\"94144\",\"01904,85150\",\"21453,13066,05456,17320,98041,78903,43526\",\"3054\",\"5768,9507,0282\",\"115\",\"13\"]',2,'2026-01-17 06:35:26','2026-01-17 06:35:26'),
(110,10,'19/11/2025','2025-11-19','2025-11-19 17:15:00',1763547300000,'2,8,3,7,0,8','283708','67214','35767','10475,51930','73087,96629,32605,97530,29756,09657,30333','7026','0342,7875,3707','117','45','[\"283708\",\"67214\",\"35767\",\"10475,51930\",\"73087,96629,32605,97530,29756,09657,30333\",\"7026\",\"0342,7875,3707\",\"117\",\"45\"]',2,'2026-01-17 06:35:26','2026-01-17 06:35:26'),
(111,10,'16/11/2025','2025-11-16','2025-11-16 17:15:00',1763288100000,'6,5,7,7,4,3','657743','88967','64505','88178,87811','17944,03970,23949,39166,36069,96389,69672','0564','6264,3701,3378','655','33','[\"657743\",\"88967\",\"64505\",\"88178,87811\",\"17944,03970,23949,39166,36069,96389,69672\",\"0564\",\"6264,3701,3378\",\"655\",\"33\"]',2,'2026-01-17 06:35:26','2026-01-17 06:35:26'),
(112,10,'12/11/2025','2025-11-12','2025-11-12 17:15:00',1762942500000,'5,2,5,9,2,8','525928','08581','86092','56105,92723','42269,31668,49852,45786,26458,38739,90102','3768','3720,7830,4240','303','99','[\"525928\",\"08581\",\"86092\",\"56105,92723\",\"42269,31668,49852,45786,26458,38739,90102\",\"3768\",\"3720,7830,4240\",\"303\",\"99\"]',2,'2026-01-17 06:35:26','2026-01-17 06:35:26'),
(113,10,'09/11/2025','2025-11-09','2025-11-09 17:15:00',1762683300000,'4,0,5,7,6,2','405762','90315','33441','46338,52021','82879,75076,14242,59557,05318,78013,05057','1392','9788,6817,3536','869','90','[\"405762\",\"90315\",\"33441\",\"46338,52021\",\"82879,75076,14242,59557,05318,78013,05057\",\"1392\",\"9788,6817,3536\",\"869\",\"90\"]',2,'2026-01-17 06:35:26','2026-01-17 06:35:26'),
(114,10,'05/11/2025','2025-11-05','2025-11-05 17:15:00',1762337700000,'8,1,9,2,5,1','819251','58849','15397','89642,65634','01849,62408,15231,44255,05828,80328,54103','1600','5664,0799,4479','718','96','[\"819251\",\"58849\",\"15397\",\"89642,65634\",\"01849,62408,15231,44255,05828,80328,54103\",\"1600\",\"5664,0799,4479\",\"718\",\"96\"]',2,'2026-01-17 06:35:26','2026-01-17 06:35:26'),
(115,10,'02/11/2025','2025-11-02','2025-11-02 17:15:00',1762078500000,'4,7,1,4,9,3','471493','18234','36902','92569,33339','59159,31465,44770,25686,44102,63367,47672','7479','1234,1967,2391','306','37','[\"471493\",\"18234\",\"36902\",\"92569,33339\",\"59159,31465,44770,25686,44102,63367,47672\",\"7479\",\"1234,1967,2391\",\"306\",\"37\"]',2,'2026-01-17 06:35:26','2026-01-17 06:35:26'),
(116,10,'29/10/2025','2025-10-29','2025-10-29 17:15:00',1761732900000,'0,6,9,1,3,2','069132','25461','05343','46861,98716','26718,58199,42243,99963,85989,35968,26356','3750','0199,9813,3103','245','02','[\"069132\",\"25461\",\"05343\",\"46861,98716\",\"26718,58199,42243,99963,85989,35968,26356\",\"3750\",\"0199,9813,3103\",\"245\",\"02\"]',2,'2026-01-17 06:35:26','2026-01-17 06:35:26'),
(117,10,'26/10/2025','2025-10-26','2025-10-26 17:15:00',1761473700000,'7,9,7,5,1,1','797511','60802','01970','42307,43512','70199,76296,24777,83326,81939,75931,76546','2711','9421,2755,0891','383','97','[\"797511\",\"60802\",\"01970\",\"42307,43512\",\"70199,76296,24777,83326,81939,75931,76546\",\"2711\",\"9421,2755,0891\",\"383\",\"97\"]',2,'2026-01-17 06:35:26','2026-01-17 06:35:26'),
(118,10,'22/10/2025','2025-10-22','2025-10-22 17:15:00',1761128100000,'0,9,1,8,0,3','091803','92797','62264','48996,90337','66191,87501,50879,59186,18589,42145,13138','5617','4808,2833,1260','133','28','[\"091803\",\"92797\",\"62264\",\"48996,90337\",\"66191,87501,50879,59186,18589,42145,13138\",\"5617\",\"4808,2833,1260\",\"133\",\"28\"]',2,'2026-01-17 06:35:26','2026-01-17 06:35:26'),
(119,10,'19/10/2025','2025-10-19','2025-10-19 17:15:00',1760868900000,'3,5,1,2,4,1','351241','18606','14956','16858,53656','64508,58771,11664,66003,36072,96177,81593','7132','2955,0353,2982','266','70','[\"351241\",\"18606\",\"14956\",\"16858,53656\",\"64508,58771,11664,66003,36072,96177,81593\",\"7132\",\"2955,0353,2982\",\"266\",\"70\"]',2,'2026-01-17 06:35:26','2026-01-17 06:35:26'),
(120,10,'15/10/2025','2025-10-15','2025-10-15 17:15:00',1760523300000,'9,5,1,9,5,8','951958','87771','74264','09896,84936','16318,20584,66729,66366,99731,17424,22239','5607','5003,3883,5273','146','17','[\"951958\",\"87771\",\"74264\",\"09896,84936\",\"16318,20584,66729,66366,99731,17424,22239\",\"5607\",\"5003,3883,5273\",\"146\",\"17\"]',2,'2026-01-17 06:35:26','2026-01-17 06:35:26'),
(121,10,'12/10/2025','2025-10-12','2025-10-12 17:15:00',1760264100000,'0,9,4,6,1,0','094610','92044','00403','67510,71482','03696,99478,27769,51685,68459,98818,97032','4714','4722,0799,9437','684','11','[\"094610\",\"92044\",\"00403\",\"67510,71482\",\"03696,99478,27769,51685,68459,98818,97032\",\"4714\",\"4722,0799,9437\",\"684\",\"11\"]',2,'2026-01-17 06:35:26','2026-01-17 06:35:26'),
(122,10,'08/10/2025','2025-10-08','2025-10-08 17:15:00',1759918500000,'0,7,7,3,4,6','077346','83543','44193','63836,59489','50785,31650,91351,80998,39785,91011,52334','7479','3039,3631,8651','960','15','[\"077346\",\"83543\",\"44193\",\"63836,59489\",\"50785,31650,91351,80998,39785,91011,52334\",\"7479\",\"3039,3631,8651\",\"960\",\"15\"]',1,'2026-01-17 06:35:26','2026-01-17 06:35:26'),
(123,10,'05/10/2025','2025-10-05','2025-10-05 17:15:00',1759659300000,'0,1,3,9,0,1','013901','38767','08745','34731,02906','43304,32563,85417,34506,30986,17267,64761','7070','5244,2369,6031','004','15','[\"013901\",\"38767\",\"08745\",\"34731,02906\",\"43304,32563,85417,34506,30986,17267,64761\",\"7070\",\"5244,2369,6031\",\"004\",\"15\"]',2,'2026-01-17 06:35:26','2026-01-17 06:35:26'),
(124,17,'05/01/2026','2026-01-05','2026-01-05 16:15:00',1767604500000,'8,2,3,8,7,8','823878','31660','39403','45422,38044','56004,83301,77760,82893,31532,84848,16286','4656','5655,4074,1888','666','26','[\"823878\",\"31660\",\"39403\",\"45422,38044\",\"56004,83301,77760,82893,31532,84848,16286\",\"4656\",\"5655,4074,1888\",\"666\",\"26\"]',2,'2026-01-17 06:35:33','2026-01-17 06:35:33'),
(125,17,'03/01/2026','2026-01-03','2026-01-03 16:15:00',1767431700000,'6,9,7,2,4,3','697243','99799','87559','25199,92810','12529,24093,14582,17580,61469,50215,42614','5349','5778,9190,1497','938','26','[\"697243\",\"99799\",\"87559\",\"25199,92810\",\"12529,24093,14582,17580,61469,50215,42614\",\"5349\",\"5778,9190,1497\",\"938\",\"26\"]',2,'2026-01-17 06:35:33','2026-01-17 06:35:33'),
(126,17,'29/12/2025','2025-12-29','2025-12-29 16:15:00',1766999700000,'9,5,6,1,9,6','956196','00385','63558','66419,95178','54188,27085,41946,56311,68045,08430,63757','0822','2342,9920,7476','677','44','[\"956196\",\"00385\",\"63558\",\"66419,95178\",\"54188,27085,41946,56311,68045,08430,63757\",\"0822\",\"2342,9920,7476\",\"677\",\"44\"]',2,'2026-01-17 06:35:33','2026-01-17 06:35:33'),
(127,17,'27/12/2025','2025-12-27','2025-12-27 16:15:00',1766826900000,'3,6,1,7,8,0','361780','94720','03367','54546,58196','04593,34624,32227,75113,03420,04285,33005','2573','4362,2546,8052','934','12','[\"361780\",\"94720\",\"03367\",\"54546,58196\",\"04593,34624,32227,75113,03420,04285,33005\",\"2573\",\"4362,2546,8052\",\"934\",\"12\"]',2,'2026-01-17 06:35:33','2026-01-17 06:35:33'),
(128,17,'22/12/2025','2025-12-22','2025-12-22 16:15:00',1766394900000,'5,4,7,0,7,8','547078','82922','98269','22369,14075','22938,08631,16584,87320,06099,49936,03325','4088','3822,4064,7603','228','38','[\"547078\",\"82922\",\"98269\",\"22369,14075\",\"22938,08631,16584,87320,06099,49936,03325\",\"4088\",\"3822,4064,7603\",\"228\",\"38\"]',2,'2026-01-17 06:35:33','2026-01-17 06:35:33'),
(129,17,'20/12/2025','2025-12-20','2025-12-20 16:15:00',1766222100000,'4,1,6,4,3,5','416435','84441','12676','49936,56590','38869,81517,68707,01946,84689,25185,48818','2081','1151,4385,5395','514','85','[\"416435\",\"84441\",\"12676\",\"49936,56590\",\"38869,81517,68707,01946,84689,25185,48818\",\"2081\",\"1151,4385,5395\",\"514\",\"85\"]',2,'2026-01-17 06:35:33','2026-01-17 06:35:33'),
(130,17,'15/12/2025','2025-12-15','2025-12-15 16:15:00',1765790100000,'5,4,8,5,6,5','548565','93742','67769','62582,43555','47282,65921,01425,36202,74022,41228,05960','6278','1452,3774,6673','869','94','[\"548565\",\"93742\",\"67769\",\"62582,43555\",\"47282,65921,01425,36202,74022,41228,05960\",\"6278\",\"1452,3774,6673\",\"869\",\"94\"]',2,'2026-01-17 06:35:33','2026-01-17 06:35:33'),
(131,17,'13/12/2025','2025-12-13','2025-12-13 16:15:00',1765617300000,'4,8,4,9,3,8','484938','86862','98842','57691,57062','92614,93305,02028,33132,14634,19823,29646','4308','6193,4495,9944','127','52','[\"484938\",\"86862\",\"98842\",\"57691,57062\",\"92614,93305,02028,33132,14634,19823,29646\",\"4308\",\"6193,4495,9944\",\"127\",\"52\"]',2,'2026-01-17 06:35:33','2026-01-17 06:35:33'),
(132,17,'08/12/2025','2025-12-08','2025-12-08 16:15:00',1765185300000,'2,8,7,5,7,0','287570','44980','01845','46931,28064','74011,66082,05573,31367,93104,83196,75884','8874','8027,5483,5044','696','90','[\"287570\",\"44980\",\"01845\",\"46931,28064\",\"74011,66082,05573,31367,93104,83196,75884\",\"8874\",\"8027,5483,5044\",\"696\",\"90\"]',2,'2026-01-17 06:35:33','2026-01-17 06:35:33'),
(133,17,'06/12/2025','2025-12-06','2025-12-06 16:15:00',1765012500000,'4,3,3,5,4,4','433544','10927','49205','91522,46552','96361,63388,07789,62442,09852,63564,84985','4374','9323,0546,8837','655','79','[\"433544\",\"10927\",\"49205\",\"91522,46552\",\"96361,63388,07789,62442,09852,63564,84985\",\"4374\",\"9323,0546,8837\",\"655\",\"79\"]',2,'2026-01-17 06:35:33','2026-01-17 06:35:33'),
(134,17,'01/12/2025','2025-12-01','2025-12-01 16:15:00',1764580500000,'9,5,3,1,1,7','953117','78216','78938','49628,67616','73680,48005,52438,09679,83079,06287,76951','9501','0371,3047,4539','022','04','[\"953117\",\"78216\",\"78938\",\"49628,67616\",\"73680,48005,52438,09679,83079,06287,76951\",\"9501\",\"0371,3047,4539\",\"022\",\"04\"]',2,'2026-01-17 06:35:33','2026-01-17 06:35:33'),
(135,17,'29/11/2025','2025-11-29','2025-11-29 16:15:00',1764407700000,'7,5,8,8,1,8','758818','39746','54246','06296,95145','32538,50143,36355,75157,21426,89485,71736','3236','8433,1322,9044','037','62','[\"758818\",\"39746\",\"54246\",\"06296,95145\",\"32538,50143,36355,75157,21426,89485,71736\",\"3236\",\"8433,1322,9044\",\"037\",\"62\"]',2,'2026-01-17 06:35:33','2026-01-17 06:35:33'),
(136,17,'24/11/2025','2025-11-24','2025-11-24 16:15:00',1763975700000,'3,9,2,5,3,0','392530','25908','39707','16799,21296','53034,40706,25967,60778,06927,46105,81598','2788','8901,1401,3332','855','40','[\"392530\",\"25908\",\"39707\",\"16799,21296\",\"53034,40706,25967,60778,06927,46105,81598\",\"2788\",\"8901,1401,3332\",\"855\",\"40\"]',2,'2026-01-17 06:35:33','2026-01-17 06:35:33'),
(137,17,'22/11/2025','2025-11-22','2025-11-22 16:15:00',1763802900000,'3,6,4,5,5,1','364551','29518','87729','86235,29185','43839,70628,01994,72036,34890,27117,66347','0213','3034,1925,5293','441','48','[\"364551\",\"29518\",\"87729\",\"86235,29185\",\"43839,70628,01994,72036,34890,27117,66347\",\"0213\",\"3034,1925,5293\",\"441\",\"48\"]',2,'2026-01-17 06:35:33','2026-01-17 06:35:33'),
(138,17,'17/11/2025','2025-11-17','2025-11-17 16:15:00',1763370900000,'9,9,8,2,2,7','998227','29546','56216','72931,46224','47136,36090,96461,33717,63317,10134,85124','3065','0430,4787,1780','054','62','[\"998227\",\"29546\",\"56216\",\"72931,46224\",\"47136,36090,96461,33717,63317,10134,85124\",\"3065\",\"0430,4787,1780\",\"054\",\"62\"]',2,'2026-01-17 06:35:33','2026-01-17 06:35:33'),
(139,17,'15/11/2025','2025-11-15','2025-11-15 16:15:00',1763198100000,'1,1,2,1,5,0','112150','89284','30942','03348,18920','13800,42129,33293,00272,44269,07364,26540','6402','5887,2716,3269','904','37','[\"112150\",\"89284\",\"30942\",\"03348,18920\",\"13800,42129,33293,00272,44269,07364,26540\",\"6402\",\"5887,2716,3269\",\"904\",\"37\"]',2,'2026-01-17 06:35:33','2026-01-17 06:35:33'),
(140,17,'10/11/2025','2025-11-10','2025-11-10 16:15:00',1762766100000,'8,3,7,0,0,9','837009','92841','95173','69540,05881','14231,44852,29190,50078,37646,06789,30671','5064','7264,9320,1812','157','86','[\"837009\",\"92841\",\"95173\",\"69540,05881\",\"14231,44852,29190,50078,37646,06789,30671\",\"5064\",\"7264,9320,1812\",\"157\",\"86\"]',2,'2026-01-17 06:35:33','2026-01-17 06:35:33'),
(141,17,'08/11/2025','2025-11-08','2025-11-08 16:15:00',1762593300000,'8,6,2,4,9,0','862490','94006','40482','64684,21283','25788,51042,52836,98279,56935,24928,60642','5006','6157,4480,4282','167','18','[\"862490\",\"94006\",\"40482\",\"64684,21283\",\"25788,51042,52836,98279,56935,24928,60642\",\"5006\",\"6157,4480,4282\",\"167\",\"18\"]',2,'2026-01-17 06:35:33','2026-01-17 06:35:33'),
(142,17,'03/11/2025','2025-11-03','2025-11-03 16:15:00',1762161300000,'8,4,2,8,2,3','842823','49787','08591','96679,18964','09260,32766,46807,01146,25794,31664,81943','4034','4100,7639,1138','253','50','[\"842823\",\"49787\",\"08591\",\"96679,18964\",\"09260,32766,46807,01146,25794,31664,81943\",\"4034\",\"4100,7639,1138\",\"253\",\"50\"]',2,'2026-01-17 06:35:33','2026-01-17 06:35:33'),
(143,17,'01/11/2025','2025-11-01','2025-11-01 16:15:00',1761988500000,'4,2,5,6,3,2','425632','26168','22853','17421,04629','68833,28879,38136,75798,63073,34046,79770','3912','0547,1482,8276','050','48','[\"425632\",\"26168\",\"22853\",\"17421,04629\",\"68833,28879,38136,75798,63073,34046,79770\",\"3912\",\"0547,1482,8276\",\"050\",\"48\"]',2,'2026-01-17 06:35:33','2026-01-17 06:35:33'),
(144,17,'27/10/2025','2025-10-27','2025-10-27 16:15:00',1761556500000,'5,8,6,7,6,9','586769','80452','96309','57607,21883','35787,14903,86604,34679,21781,21988,14568','4452','8176,7642,5543','661','55','[\"586769\",\"80452\",\"96309\",\"57607,21883\",\"35787,14903,86604,34679,21781,21988,14568\",\"4452\",\"8176,7642,5543\",\"661\",\"55\"]',2,'2026-01-17 06:35:33','2026-01-17 06:35:33'),
(145,17,'25/10/2025','2025-10-25','2025-10-25 16:15:00',1761383700000,'0,1,6,8,5,5','016855','38816','60342','32663,32110','71662,44287,56886,08893,19288,97699,12813','9617','8804,9443,6823','367','34','[\"016855\",\"38816\",\"60342\",\"32663,32110\",\"71662,44287,56886,08893,19288,97699,12813\",\"9617\",\"8804,9443,6823\",\"367\",\"34\"]',2,'2026-01-17 06:35:33','2026-01-17 06:35:33'),
(146,17,'20/10/2025','2025-10-20','2025-10-20 16:15:00',1760951700000,'2,6,1,5,0,4','261504','49726','58660','88183,97831','89650,56620,98366,14642,03043,68914,14933','1417','2411,0972,2006','391','48','[\"261504\",\"49726\",\"58660\",\"88183,97831\",\"89650,56620,98366,14642,03043,68914,14933\",\"1417\",\"2411,0972,2006\",\"391\",\"48\"]',2,'2026-01-17 06:35:33','2026-01-17 06:35:33'),
(147,17,'18/10/2025','2025-10-18','2025-10-18 16:15:00',1760778900000,'5,6,7,5,6,7','567567','97111','80536','68133,82654','35044,96876,77407,84801,49132,21773,87865','5884','7793,5385,5867','551','49','[\"567567\",\"97111\",\"80536\",\"68133,82654\",\"35044,96876,77407,84801,49132,21773,87865\",\"5884\",\"7793,5385,5867\",\"551\",\"49\"]',2,'2026-01-17 06:35:33','2026-01-17 06:35:33'),
(148,17,'13/10/2025','2025-10-13','2025-10-13 16:15:00',1760346900000,'1,6,7,6,9,9','167699','83460','65713','81221,01713','89847,62589,44483,87773,07376,75211,88528','8916','5345,7485,1721','145','23','[\"167699\",\"83460\",\"65713\",\"81221,01713\",\"89847,62589,44483,87773,07376,75211,88528\",\"8916\",\"5345,7485,1721\",\"145\",\"23\"]',2,'2026-01-17 06:35:33','2026-01-17 06:35:33'),
(149,17,'11/10/2025','2025-10-11','2025-10-11 16:15:00',1760174100000,'6,8,8,4,1,6','688416','25869','83226','61769,37125','85294,49527,56337,33647,38398,51617,24544','4425','9362,7250,4754','900','72','[\"688416\",\"25869\",\"83226\",\"61769,37125\",\"85294,49527,56337,33647,38398,51617,24544\",\"4425\",\"9362,7250,4754\",\"900\",\"72\"]',2,'2026-01-17 06:35:33','2026-01-17 06:35:33'),
(150,17,'06/10/2025','2025-10-06','2025-10-06 16:15:00',1759742100000,'0,9,2,6,1,2','092612','47917','51868','06066,42180','22894,40118,99026,54423,41262,53805,04941','2716','1571,9770,9198','401','82','[\"092612\",\"47917\",\"51868\",\"06066,42180\",\"22894,40118,99026,54423,41262,53805,04941\",\"2716\",\"1571,9770,9198\",\"401\",\"82\"]',2,'2026-01-17 06:35:33','2026-01-17 06:35:33'),
(151,27,'14/01/2026','2026-01-14','2026-01-14 16:15:00',1768382100000,'4,4,0,8,7,1','440871','68343','12289','33879,49927','24585,58787,20685,87083,84897,99256,90499','3559','2733,4889,6711','219','58','[\"440871\",\"68343\",\"12289\",\"33879,49927\",\"24585,58787,20685,87083,84897,99256,90499\",\"3559\",\"2733,4889,6711\",\"219\",\"58\"]',2,'2026-01-17 06:35:33','2026-01-17 06:35:33'),
(152,27,'07/01/2026','2026-01-07','2026-01-07 16:15:00',1767777300000,'3,2,9,5,2,9','329529','65191','58121','91117,94540','09890,48871,98177,49451,30304,55970,51053','2585','0509,9531,8966','391','40','[\"329529\",\"65191\",\"58121\",\"91117,94540\",\"09890,48871,98177,49451,30304,55970,51053\",\"2585\",\"0509,9531,8966\",\"391\",\"40\"]',2,'2026-01-17 06:35:33','2026-01-17 06:35:33'),
(153,27,'31/12/2025','2025-12-31','2025-12-31 16:15:00',1767172500000,'6,8,1,9,8,1','681981','01357','07480','58462,81728','51261,83782,01736,34044,76531,58876,76029','5597','3320,3808,1288','119','15','[\"681981\",\"01357\",\"07480\",\"58462,81728\",\"51261,83782,01736,34044,76531,58876,76029\",\"5597\",\"3320,3808,1288\",\"119\",\"15\"]',2,'2026-01-17 06:35:33','2026-01-17 06:35:33'),
(154,27,'24/12/2025','2025-12-24','2025-12-24 16:15:00',1766567700000,'6,8,9,3,2,7','689327','54438','34279','02599,18100','34004,24974,29710,97949,35206,84755,14601','1209','4419,5583,6853','952','83','[\"689327\",\"54438\",\"34279\",\"02599,18100\",\"34004,24974,29710,97949,35206,84755,14601\",\"1209\",\"4419,5583,6853\",\"952\",\"83\"]',2,'2026-01-17 06:35:33','2026-01-17 06:35:33'),
(155,27,'17/12/2025','2025-12-17','2025-12-17 16:15:00',1765962900000,'6,7,8,4,8,2','678482','20045','48413','81759,46746','91804,47867,76598,21576,48610,66816,38382','7288','4238,4325,2592','085','90','[\"678482\",\"20045\",\"48413\",\"81759,46746\",\"91804,47867,76598,21576,48610,66816,38382\",\"7288\",\"4238,4325,2592\",\"085\",\"90\"]',2,'2026-01-17 06:35:33','2026-01-17 06:35:33'),
(156,27,'10/12/2025','2025-12-10','2025-12-10 16:15:00',1765358100000,'0,4,8,5,6,8','048568','69756','22643','27638,35654','96397,05333,84227,29346,77088,39933,58592','4409','0868,0263,8233','353','87','[\"048568\",\"69756\",\"22643\",\"27638,35654\",\"96397,05333,84227,29346,77088,39933,58592\",\"4409\",\"0868,0263,8233\",\"353\",\"87\"]',2,'2026-01-17 06:35:33','2026-01-17 06:35:33'),
(157,27,'03/12/2025','2025-12-03','2025-12-03 16:15:00',1764753300000,'7,9,3,3,9,4','793394','53973','58689','31785,42090','89812,02711,91772,72388,43133,84415,98855','3545','8117,9808,7743','619','23','[\"793394\",\"53973\",\"58689\",\"31785,42090\",\"89812,02711,91772,72388,43133,84415,98855\",\"3545\",\"8117,9808,7743\",\"619\",\"23\"]',2,'2026-01-17 06:35:33','2026-01-17 06:35:33'),
(158,27,'26/11/2025','2025-11-26','2025-11-26 16:15:00',1764148500000,'6,2,5,0,1,8','625018','45737','99924','92028,21808','01948,13566,42182,35554,08748,11868,91402','5604','7707,6711,7785','392','70','[\"625018\",\"45737\",\"99924\",\"92028,21808\",\"01948,13566,42182,35554,08748,11868,91402\",\"5604\",\"7707,6711,7785\",\"392\",\"70\"]',2,'2026-01-17 06:35:33','2026-01-17 06:35:33'),
(159,27,'19/11/2025','2025-11-19','2025-11-19 16:15:00',1763543700000,'3,0,0,1,6,7','300167','14332','03936','69553,31723','97617,54133,96888,41173,98427,32652,05180','1874','8170,4154,9871','502','53','[\"300167\",\"14332\",\"03936\",\"69553,31723\",\"97617,54133,96888,41173,98427,32652,05180\",\"1874\",\"8170,4154,9871\",\"502\",\"53\"]',2,'2026-01-17 06:35:33','2026-01-17 06:35:33'),
(160,27,'12/11/2025','2025-11-12','2025-11-12 16:15:00',1762938900000,'1,1,9,3,4,9','119349','51959','39891','82789,06822','73541,64682,55871,76478,90383,17354,11202','0246','3719,3173,0010','367','52','[\"119349\",\"51959\",\"39891\",\"82789,06822\",\"73541,64682,55871,76478,90383,17354,11202\",\"0246\",\"3719,3173,0010\",\"367\",\"52\"]',2,'2026-01-17 06:35:33','2026-01-17 06:35:33'),
(161,27,'05/11/2025','2025-11-05','2025-11-05 16:15:00',1762334100000,'7,6,7,4,5,9','767459','22080','88976','20474,86456','92644,98871,76122,57724,71748,04279,11961','8865','9487,5769,1389','961','06','[\"767459\",\"22080\",\"88976\",\"20474,86456\",\"92644,98871,76122,57724,71748,04279,11961\",\"8865\",\"9487,5769,1389\",\"961\",\"06\"]',2,'2026-01-17 06:35:33','2026-01-17 06:35:33'),
(162,27,'29/10/2025','2025-10-29','2025-10-29 16:15:00',1761729300000,'6,3,0,0,3,8','630038','53665','27823','76069,26565','96063,10557,40008,49401,53672,07061,65540','1486','3969,5356,1840','260','18','[\"630038\",\"53665\",\"27823\",\"76069,26565\",\"96063,10557,40008,49401,53672,07061,65540\",\"1486\",\"3969,5356,1840\",\"260\",\"18\"]',2,'2026-01-17 06:35:33','2026-01-17 06:35:33'),
(163,27,'22/10/2025','2025-10-22','2025-10-22 16:15:00',1761124500000,'2,2,1,1,7,4','221174','93768','96836','64882,14114','90655,68185,71079,02666,69247,90260,19285','4208','5474,5290,0688','523','85','[\"221174\",\"93768\",\"96836\",\"64882,14114\",\"90655,68185,71079,02666,69247,90260,19285\",\"4208\",\"5474,5290,0688\",\"523\",\"85\"]',2,'2026-01-17 06:35:33','2026-01-17 06:35:33'),
(164,27,'15/10/2025','2025-10-15','2025-10-15 16:15:00',1760519700000,'0,1,1,0,8,9','011089','82065','78414','85600,70890','95140,59210,38365,13498,04211,15296,55917','5155','0084,3911,7160','723','55','[\"011089\",\"82065\",\"78414\",\"85600,70890\",\"95140,59210,38365,13498,04211,15296,55917\",\"5155\",\"0084,3911,7160\",\"723\",\"55\"]',2,'2026-01-17 06:35:33','2026-01-17 06:35:33'),
(165,27,'08/10/2025','2025-10-08','2025-10-08 16:15:00',1759914900000,'3,6,2,3,8,4','362384','27650','67139','02879,46143','22031,92017,38627,64467,95366,98264,90798','7893','7494,4642,2782','061','97','[\"362384\",\"27650\",\"67139\",\"02879,46143\",\"22031,92017,38627,64467,95366,98264,90798\",\"7893\",\"7494,4642,2782\",\"061\",\"97\"]',2,'2026-01-17 06:35:33','2026-01-17 06:35:33'),
(166,27,'01/10/2025','2025-10-01','2025-10-01 16:15:00',1759310100000,'0,7,9,8,9,6','079896','76980','76534','60779,11682','27108,46077,35191,36157,68679,43807,69792','1036','9795,7326,3461','353','94','[\"079896\",\"76980\",\"76534\",\"60779,11682\",\"27108,46077,35191,36157,68679,43807,69792\",\"1036\",\"9795,7326,3461\",\"353\",\"94\"]',2,'2026-01-17 06:35:33','2026-01-17 06:35:33'),
(167,27,'24/09/2025','2025-09-24','2025-09-24 16:15:00',1758705300000,'0,5,5,9,1,1','055911','07977','54192','18741,46864','90301,85673,81149,15929,43523,75161,29693','0703','7777,1244,0578','567','34','[\"055911\",\"07977\",\"54192\",\"18741,46864\",\"90301,85673,81149,15929,43523,75161,29693\",\"0703\",\"7777,1244,0578\",\"567\",\"34\"]',2,'2026-01-17 06:35:33','2026-01-17 06:35:33'),
(168,27,'17/09/2025','2025-09-17','2025-09-17 16:15:00',1758100500000,'8,5,1,5,5,7','851557','57993','68954','15984,35563','51539,24343,04883,33397,32023,77321,49888','4353','5914,1421,4526','113','82','[\"851557\",\"57993\",\"68954\",\"15984,35563\",\"51539,24343,04883,33397,32023,77321,49888\",\"4353\",\"5914,1421,4526\",\"113\",\"82\"]',2,'2026-01-17 06:35:33','2026-01-17 06:35:33'),
(169,27,'10/09/2025','2025-09-10','2025-09-10 16:15:00',1757495700000,'0,5,3,9,0,7','053907','51504','15497','65767,27769','14612,20141,02268,04467,53853,18072,74401','4429','6356,5654,5646','275','27','[\"053907\",\"51504\",\"15497\",\"65767,27769\",\"14612,20141,02268,04467,53853,18072,74401\",\"4429\",\"6356,5654,5646\",\"275\",\"27\"]',2,'2026-01-17 06:35:33','2026-01-17 06:35:33'),
(170,27,'03/09/2025','2025-09-03','2025-09-03 16:15:00',1756890900000,'6,7,4,2,8,8','674288','54049','23538','27559,21912','44950,72070,64108,53747,87761,90092,87121','6695','3681,9762,8513','523','29','[\"674288\",\"54049\",\"23538\",\"27559,21912\",\"44950,72070,64108,53747,87761,90092,87121\",\"6695\",\"3681,9762,8513\",\"523\",\"29\"]',2,'2026-01-17 06:35:33','2026-01-17 06:35:33'),
(171,27,'27/08/2025','2025-08-27','2025-08-27 16:15:00',1756286100000,'3,9,4,7,7,8','394778','60744','59733','70650,02199','26146,20233,17177,62566,57061,65473,03716','6027','8143,9629,5247','740','83','[\"394778\",\"60744\",\"59733\",\"70650,02199\",\"26146,20233,17177,62566,57061,65473,03716\",\"6027\",\"8143,9629,5247\",\"740\",\"83\"]',2,'2026-01-17 06:35:33','2026-01-17 06:35:33'),
(172,27,'20/08/2025','2025-08-20','2025-08-20 16:15:00',1755681300000,'9,6,0,0,0,5','960005','79093','85881','32135,01988','85407,73473,04547,09833,64649,25098,90019','3128','3645,8818,4236','849','71','[\"960005\",\"79093\",\"85881\",\"32135,01988\",\"85407,73473,04547,09833,64649,25098,90019\",\"3128\",\"3645,8818,4236\",\"849\",\"71\"]',2,'2026-01-17 06:35:33','2026-01-17 06:35:33'),
(173,27,'13/08/2025','2025-08-13','2025-08-13 16:15:00',1755076500000,'3,6,5,5,4,9','365549','66726','16390','16079,58289','70451,06364,31667,71438,01028,05416,64961','3449','0538,0662,4088','369','22','[\"365549\",\"66726\",\"16390\",\"16079,58289\",\"70451,06364,31667,71438,01028,05416,64961\",\"3449\",\"0538,0662,4088\",\"369\",\"22\"]',2,'2026-01-17 06:35:33','2026-01-17 06:35:33'),
(174,27,'06/08/2025','2025-08-06','2025-08-06 16:15:00',1754471700000,'4,1,9,7,5,3','419753','97529','82377','65710,06953','51360,82642,35367,38676,74605,07288,36300','7969','3039,9559,4546','404','90','[\"419753\",\"97529\",\"82377\",\"65710,06953\",\"51360,82642,35367,38676,74605,07288,36300\",\"7969\",\"3039,9559,4546\",\"404\",\"90\"]',2,'2026-01-17 06:35:33','2026-01-17 06:35:33'),
(175,27,'30/07/2025','2025-07-30','2025-07-30 16:15:00',1753866900000,'0,8,4,3,6,1','084361','48486','73323','56574,69364','46100,92371,37203,78684,43402,30898,61194','9769','7595,3371,7747','714','45','[\"084361\",\"48486\",\"73323\",\"56574,69364\",\"46100,92371,37203,78684,43402,30898,61194\",\"9769\",\"7595,3371,7747\",\"714\",\"45\"]',2,'2026-01-17 06:35:33','2026-01-17 06:35:33'),
(176,27,'23/07/2025','2025-07-23','2025-07-23 16:15:00',1753262100000,'6,8,0,9,5,6','680956','83659','24283','81500,62639','18959,68578,94982,62353,04975,55950,98252','5428','2556,1954,5620','884','25','[\"680956\",\"83659\",\"24283\",\"81500,62639\",\"18959,68578,94982,62353,04975,55950,98252\",\"5428\",\"2556,1954,5620\",\"884\",\"25\"]',2,'2026-01-17 06:35:33','2026-01-17 06:35:33'),
(177,27,'16/07/2025','2025-07-16','2025-07-16 16:15:00',1752657300000,'9,4,4,8,4,2','944842','06477','40960','33503,55633','21298,31759,03962,83496,53252,39980,67553','7015','7544,4859,3724','510','16','[\"944842\",\"06477\",\"40960\",\"33503,55633\",\"21298,31759,03962,83496,53252,39980,67553\",\"7015\",\"7544,4859,3724\",\"510\",\"16\"]',2,'2026-01-17 06:35:33','2026-01-17 06:35:33'),
(178,27,'09/07/2025','2025-07-09','2025-07-09 16:15:00',1752052500000,'3,8,1,1,3,1','381131','04775','43688','26184,97766','02471,10984,77061,86245,11378,99598,12011','6806','9528,5054,5020','619','24','[\"381131\",\"04775\",\"43688\",\"26184,97766\",\"02471,10984,77061,86245,11378,99598,12011\",\"6806\",\"9528,5054,5020\",\"619\",\"24\"]',2,'2026-01-17 06:35:33','2026-01-17 06:35:33'),
(179,27,'02/07/2025','2025-07-02','2025-07-02 16:15:00',1751447700000,'0,5,8,5,7,3','058573','49661','91829','62965,29817','62708,59790,80695,44480,46374,32438,98411','8832','5783,5167,6305','466','39','[\"058573\",\"49661\",\"91829\",\"62965,29817\",\"62708,59790,80695,44480,46374,32438,98411\",\"8832\",\"5783,5167,6305\",\"466\",\"39\"]',2,'2026-01-17 06:35:33','2026-01-17 06:35:33'),
(180,27,'25/06/2025','2025-06-25','2025-06-25 16:15:00',1750842900000,'7,9,1,8,8,6','791886','97792','41694','02273,93305','35749,33507,09391,14336,94650,73049,49611','1616','8972,3618,1025','625','01','[\"791886\",\"97792\",\"41694\",\"02273,93305\",\"35749,33507,09391,14336,94650,73049,49611\",\"1616\",\"8972,3618,1025\",\"625\",\"01\"]',2,'2026-01-17 06:35:33','2026-01-17 06:35:33'),
(181,28,'14/01/2026','2026-01-14','2026-01-14 16:15:00',1768382100000,'4,2,0,7,7,1','420771','91081','94042','49674,41352','89614,93688,90280,79151,67378,22312,70575','3824','4348,3019,5813','925','66','[\"420771\",\"91081\",\"94042\",\"49674,41352\",\"89614,93688,90280,79151,67378,22312,70575\",\"3824\",\"4348,3019,5813\",\"925\",\"66\"]',2,'2026-01-17 06:35:34','2026-01-17 06:35:34'),
(182,28,'07/01/2026','2026-01-07','2026-01-07 16:15:00',1767777300000,'8,9,4,9,9,7','894997','25418','39253','47171,88241','10753,79622,26599,50074,61275,46882,41902','4482','1777,2925,6758','431','01','[\"894997\",\"25418\",\"39253\",\"47171,88241\",\"10753,79622,26599,50074,61275,46882,41902\",\"4482\",\"1777,2925,6758\",\"431\",\"01\"]',2,'2026-01-17 06:35:34','2026-01-17 06:35:34'),
(183,28,'31/12/2025','2025-12-31','2025-12-31 16:15:00',1767172500000,'2,1,5,8,5,2','215852','10235','84633','95358,10636','64177,75717,64534,13104,81772,14374,74022','6568','6449,8530,2867','522','99','[\"215852\",\"10235\",\"84633\",\"95358,10636\",\"64177,75717,64534,13104,81772,14374,74022\",\"6568\",\"6449,8530,2867\",\"522\",\"99\"]',2,'2026-01-17 06:35:34','2026-01-17 06:35:34'),
(184,28,'24/12/2025','2025-12-24','2025-12-24 16:15:00',1766567700000,'6,6,7,7,8,9','667789','83883','10364','11762,41760','34248,91307,27803,02598,78612,27220,52686','8417','1273,8331,3655','687','85','[\"667789\",\"83883\",\"10364\",\"11762,41760\",\"34248,91307,27803,02598,78612,27220,52686\",\"8417\",\"1273,8331,3655\",\"687\",\"85\"]',2,'2026-01-17 06:35:34','2026-01-17 06:35:34'),
(185,28,'17/12/2025','2025-12-17','2025-12-17 16:15:00',1765962900000,'7,4,6,5,9,7','746597','22517','78765','89186,25491','81962,42756,29235,63489,45403,02649,72647','2481','2045,0253,9780','630','05','[\"746597\",\"22517\",\"78765\",\"89186,25491\",\"81962,42756,29235,63489,45403,02649,72647\",\"2481\",\"2045,0253,9780\",\"630\",\"05\"]',2,'2026-01-17 06:35:34','2026-01-17 06:35:34'),
(186,28,'10/12/2025','2025-12-10','2025-12-10 16:15:00',1765358100000,'3,7,5,4,9,2','375492','05173','88682','45313,55483','75232,37632,68479,60203,35922,92009,46574','3256','3626,2263,7933','014','20','[\"375492\",\"05173\",\"88682\",\"45313,55483\",\"75232,37632,68479,60203,35922,92009,46574\",\"3256\",\"3626,2263,7933\",\"014\",\"20\"]',2,'2026-01-17 06:35:34','2026-01-17 06:35:34'),
(187,28,'03/12/2025','2025-12-03','2025-12-03 16:15:00',1764753300000,'4,5,2,1,6,9','452169','17220','35750','94011,84231','46411,06551,14226,16779,55838,76423,79700','5212','1679,5713,0477','184','97','[\"452169\",\"17220\",\"35750\",\"94011,84231\",\"46411,06551,14226,16779,55838,76423,79700\",\"5212\",\"1679,5713,0477\",\"184\",\"97\"]',2,'2026-01-17 06:35:34','2026-01-17 06:35:34'),
(188,28,'26/11/2025','2025-11-26','2025-11-26 16:15:00',1764148500000,'6,9,3,3,4,8','693348','63238','10499','41408,83683','08958,61749,14800,21921,70597,86952,38763','6669','7712,8144,0611','434','09','[\"693348\",\"63238\",\"10499\",\"41408,83683\",\"08958,61749,14800,21921,70597,86952,38763\",\"6669\",\"7712,8144,0611\",\"434\",\"09\"]',2,'2026-01-17 06:35:34','2026-01-17 06:35:34'),
(189,28,'19/11/2025','2025-11-19','2025-11-19 16:15:00',1763543700000,'6,4,6,9,6,0','646960','31978','24485','34068,81794','27967,85080,66221,05576,79496,31437,42798','5255','4352,5574,7489','245','38','[\"646960\",\"31978\",\"24485\",\"34068,81794\",\"27967,85080,66221,05576,79496,31437,42798\",\"5255\",\"4352,5574,7489\",\"245\",\"38\"]',2,'2026-01-17 06:35:34','2026-01-17 06:35:34'),
(190,28,'12/11/2025','2025-11-12','2025-11-12 16:15:00',1762938900000,'7,0,3,9,4,7','703947','53461','97990','97723,29271','24392,98395,59247,51921,84242,39187,61855','3576','6671,7106,4660','044','31','[\"703947\",\"53461\",\"97990\",\"97723,29271\",\"24392,98395,59247,51921,84242,39187,61855\",\"3576\",\"6671,7106,4660\",\"044\",\"31\"]',2,'2026-01-17 06:35:34','2026-01-17 06:35:34'),
(191,28,'05/11/2025','2025-11-05','2025-11-05 16:15:00',1762334100000,'4,5,7,0,7,9','457079','58888','22009','45585,38067','04616,19422,42829,41643,69872,68976,06484','7141','4747,1277,0146','282','76','[\"457079\",\"58888\",\"22009\",\"45585,38067\",\"04616,19422,42829,41643,69872,68976,06484\",\"7141\",\"4747,1277,0146\",\"282\",\"76\"]',2,'2026-01-17 06:35:34','2026-01-17 06:35:34'),
(192,28,'29/10/2025','2025-10-29','2025-10-29 16:15:00',1761729300000,'6,3,4,6,1,1','634611','79281','01240','81033,07449','14831,34140,83726,10729,18594,59274,69867','8934','8426,3603,6850','524','54','[\"634611\",\"79281\",\"01240\",\"81033,07449\",\"14831,34140,83726,10729,18594,59274,69867\",\"8934\",\"8426,3603,6850\",\"524\",\"54\"]',2,'2026-01-17 06:35:34','2026-01-17 06:35:34'),
(193,28,'22/10/2025','2025-10-22','2025-10-22 16:15:00',1761124500000,'8,3,4,4,4,1','834441','68664','95336','18784,49787','60651,19569,63094,41357,31534,86209,38583','1239','2748,9078,5689','592','21','[\"834441\",\"68664\",\"95336\",\"18784,49787\",\"60651,19569,63094,41357,31534,86209,38583\",\"1239\",\"2748,9078,5689\",\"592\",\"21\"]',2,'2026-01-17 06:35:34','2026-01-17 06:35:34'),
(194,28,'15/10/2025','2025-10-15','2025-10-15 16:15:00',1760519700000,'7,9,9,2,1,8','799218','85724','86045','01290,40630','15030,30046,81819,61211,09511,05991,15080','1421','2583,5951,8933','000','25','[\"799218\",\"85724\",\"86045\",\"01290,40630\",\"15030,30046,81819,61211,09511,05991,15080\",\"1421\",\"2583,5951,8933\",\"000\",\"25\"]',2,'2026-01-17 06:35:34','2026-01-17 06:35:34'),
(195,28,'08/10/2025','2025-10-08','2025-10-08 16:15:00',1759914900000,'0,4,6,4,3,9','046439','12476','51574','77271,75981','19253,11513,31723,94233,11524,52858,25082','3263','9089,1882,5222','133','84','[\"046439\",\"12476\",\"51574\",\"77271,75981\",\"19253,11513,31723,94233,11524,52858,25082\",\"3263\",\"9089,1882,5222\",\"133\",\"84\"]',2,'2026-01-17 06:35:34','2026-01-17 06:35:34'),
(196,28,'01/10/2025','2025-10-01','2025-10-01 16:15:00',1759310100000,'1,2,7,0,2,1','127021','44355','46106','41040,67631','35618,74743,54509,55809,28189,29228,96543','1123','7445,5159,7254','669','76','[\"127021\",\"44355\",\"46106\",\"41040,67631\",\"35618,74743,54509,55809,28189,29228,96543\",\"1123\",\"7445,5159,7254\",\"669\",\"76\"]',2,'2026-01-17 06:35:34','2026-01-17 06:35:34'),
(197,28,'24/09/2025','2025-09-24','2025-09-24 16:15:00',1758705300000,'4,5,2,8,7,4','452874','85648','52011','77991,02822','97473,16283,83167,07793,36222,16170,23317','1420','5562,9153,0239','302','12','[\"452874\",\"85648\",\"52011\",\"77991,02822\",\"97473,16283,83167,07793,36222,16170,23317\",\"1420\",\"5562,9153,0239\",\"302\",\"12\"]',2,'2026-01-17 06:35:34','2026-01-17 06:35:34'),
(198,28,'17/09/2025','2025-09-17','2025-09-17 16:15:00',1758100500000,'6,1,3,4,8,5','613485','92486','78384','62006,28442','10106,16530,77396,68883,28992,52429,37818','0141','3898,9084,9864','548','44','[\"613485\",\"92486\",\"78384\",\"62006,28442\",\"10106,16530,77396,68883,28992,52429,37818\",\"0141\",\"3898,9084,9864\",\"548\",\"44\"]',2,'2026-01-17 06:35:34','2026-01-17 06:35:34'),
(199,28,'10/09/2025','2025-09-10','2025-09-10 16:15:00',1757495700000,'7,8,6,7,6,1','786761','48393','42429','00429,82579','76004,15099,72408,09371,43611,63098,72655','2732','0248,3469,5547','171','92','[\"786761\",\"48393\",\"42429\",\"00429,82579\",\"76004,15099,72408,09371,43611,63098,72655\",\"2732\",\"0248,3469,5547\",\"171\",\"92\"]',2,'2026-01-17 06:35:34','2026-01-17 06:35:34'),
(200,28,'03/09/2025','2025-09-03','2025-09-03 16:15:00',1756890900000,'1,3,0,1,3,2','130132','48314','94568','46427,62230','96939,62680,09731,09608,07652,99083,80685','9919','1640,3881,7547','454','82','[\"130132\",\"48314\",\"94568\",\"46427,62230\",\"96939,62680,09731,09608,07652,99083,80685\",\"9919\",\"1640,3881,7547\",\"454\",\"82\"]',2,'2026-01-17 06:35:34','2026-01-17 06:35:34'),
(201,28,'27/08/2025','2025-08-27','2025-08-27 16:15:00',1756286100000,'2,3,4,8,3,8','234838','55107','63333','08777,01273','49381,00559,50482,35951,15476,25956,96306','9060','4993,3503,1525','041','58','[\"234838\",\"55107\",\"63333\",\"08777,01273\",\"49381,00559,50482,35951,15476,25956,96306\",\"9060\",\"4993,3503,1525\",\"041\",\"58\"]',2,'2026-01-17 06:35:34','2026-01-17 06:35:34'),
